,title,score,num_comments
2222,Cafe tagged with anti-Semitic hate speech; hate crimes on the rise in San Francisco,111,75
14855,Chicago Fed economists see 'U-Cov' jobless rate as high as 34%,111,18
5345,Idaho man wins lottery for the sixth time,111,22
8779,Iconic new tower opens as pandemic crushes Manhattan office market,111,10
11236,Virginia man charged in connection with cross burning,111,10
16105,Leader of church group sentenced on tax evasion charges,112,19
15204,"Dyker Heights murder suspect allegedly killed and ate dad, turning home into horrific crime scene.",112,22
14950,Court rules insurers can collect $12B under health care law,112,31
11424,Tanzanian miner becomes overnight millionaire,112,13
16099,"Boeing Dreamliner production problems threaten the aircraft's safety, former quality manager warns",112,13
8855,"Landslides in Nepal kill 12 people, at least 21 missing.",112,3
9930,"Chicago police, protesters clash during bid to topple statue",112,67
11999,Canada loses high-profile bid for United Nations Security Council seat,112,20
4810,LA sheriff’s office to attend parole hearings after outrage over Manson ‘family’ case,112,7
6432,150-Foot Vessel Sculpture at Hudson Yards Closes After 3rd Suicide,112,27
15184,Beaumont closes key hospital in Detroit Metro Area,112,34
16277,Iran general steps out of Soleimani’s shadow to lead proxies,112,22
8885,MLB game is delayed after an armed standoff outside stadium,112,35
1797,"Windows 10 to be retired in 2025, as new OS unveils",112,99
14937,Taiwan citizens can now donate masks to countries in need,112,3
13462,"School is out for the summer, but cafeteria food is still available for Hillsborough County students",112,5
10839,Tesla shareholders urged to oust Elon Musk over $55bn pay deal,112,68
12489,"Four killed, over 50 injured in oil tanker explosion in China",112,4
6496,Parents and Campaigners Condemn Free School Meal Parcels as ‘Unacceptable’,113,25
1461,EU envoy: Ethiopian leadership vowed to 'wipe out' Tigrayans,113,3
125,Downing Street party: No 10 staff joked about party amid lockdown restrictions,113,25
3656,Boeing 777 makes emergency landing in Moscow after engine sensor problem,113,22
11135,Tokyo objects to expanded G-7 summit including Seoul,113,25
2097,"Delta Variant Accounts for Nearly 5% of COVID Cases in New York City, New Data Shows",113,32
9146,"Daisha Riley, 'Good Morning America' producer, dies at 35",113,23
997,Senators question DOJ funding for AI-powered policing tech,113,11
4768,Scientists Taught Spinach How to Send Emails to Help Fight Climate Change — and This Isn't a Joke,113,14
9818,Former Calgary Dinos employee arrested after alleged racist incident,113,16
11140,Vancouver’s Old Apple Tree finally succumbs after nearly two centuries,114,14
205,"In major change, United Arab Emirates will move official workweek to Monday through Friday",114,11
5372,"Chevron and Exxon discussed merger last year after Covid pandemic devastated oil prices, reports say",114,18
1962,Novavax: Large study finds COVID-19 shot about 90% effective,114,14
745,"UN: In war, 16 million Yemenis 'marching' toward starvation",114,12
1942,Christiane Amanpour shares cancer diagnosis with viewers,114,12
16371,"Convicted Robbers Charged in Oakland Laptop Theft, Homicide",114,18
7544,Holiday shipping gridlock is delaying 6 million packages a day,114,16
3905,German charged with passing parliament floor plans to Russia,114,2
1341,Woman overjoyed at birth of great-great-great-grandchild in Edinburgh,114,38
5403,"Israel to transfer 5,000 vaccine doses to Palestinians",114,65
8407,"Ontario reports 1,248 COVID-19 cases and 29 new deaths on Sunday",114,6
3984,"U.S. Wind, Solar Post Record Growth in 2020 Despite Pandemic Restrictions, Job Losses",114,19
2264,Police: Suspected Baltimore gang leader dead after standoff,114,27
8442,Coroner hopes Joplin woman will agree to legal disposition of husband's body,114,18
11063,US pending home sales see record-breaking rebound in May,114,39
9260,Zoom is Now Worth More Than the World’s 7 Biggest Airlines,115,33
5271,Muslim Council of Britain elects first female leader,115,10
28,‘Doom metal’ organist’s Paris show cancelled amid Catholic protests,115,53
9108,"DHS, FAA issue temporary flight restriction over City of Portland",115,35
9772,Global banks scrutinize their Hong Kong clients for pro-democracy ties - sources,115,9
12903,Korean grandfather allegedly beaten up in US because of 'skin colour',115,7
9997,"Tallahassee Police sergeant on leave for 'questionable' social media post about mural, protests",115,10
4814,Protests Rise After Officer in Tamir Rice Shooting Plays on Football Team,115,68
6116,Man offers Newport council £50m if it helps find bitcoins in landfill,115,46
8720,Taiwan scrambles jets as 18 Chinese planes buzz during U.S. visit,115,11
1391,Palestinian Authority calls off vaccine exchange with Israel,115,134
13508,Amazon distribution center in Redlands engulfed in flames as three-alarm fire rages,115,14
1071,"Streatham attack: Sudesh Amman knife rampage could have been prevented if opportunity to send him to jail not missed, jury finds | UK News",116,9
2924,Medically vulnerable in US put near end of vaccine line,116,38
2439,Lawyer: Iran charges detained French tourist with spying,116,35
11504,Suspect In The Fire Set At Wendy's During Protests Taken Into Custody | 90.1 FM WABE,116,18
8581,"On a mission to save more lives, Nashville firefighter donates kidney to his sister",116,4
11844,Protesters sue CMPD over 4th Street violence; judge restricts force at Juneteenth march,116,2
14702,"Teen receives ""punishment"" for torturing deer.",116,34
3273,Videos Show Extent of Myanmar Military’s Bloody Crackdown,116,3
4472,Klamath Falls man kicked off Delta flight over seating concerns amid pandemic,116,21
522,Brazilian player charged with attempted murder after attack on referee | Soccer,116,12
3998,NYC rally held for teen shot by state police in Pennsylvania,116,16
13811,California man allegedly caught eating body of relative: report,116,52
7302,Indian Army officer accused of raping friend’s wife arrested,117,6
7313,"Man shot by Daytona Beach police charged at officers, body camera video shows",117,50
6838,Hyundai's value surges by $9bn amid reports of Apple electric car deal,117,11
3940,"Quarantine officer charged with extortion, sexual assault after demanding cash fine from Ont. resident",117,8
13596,Hydrogen trains could be on their way to Italy after major firms seal five-year agreement,117,9
14646,"Pitt mourns med school research professor Bing Liu, who was found shot to death",117,8
3827,Capitol Police chief warns extremists 'want to blow up the Capitol' when Biden gives State of the Union address,117,78
83,Closing arguments set in actor Jussie Smollett's trial | AP News,117,66
13230,"Charges: Teen coerced 10-year-old Utah girl to disrobe, engage in sexual acts online",117,10
15132,Caught on video: small plane makes spectacular emergency landing on highway near Quebec City,117,14
11033,Three men arrested for murder in case of missing California couple Audrey Moran and Jonathan Reynoso who vanished in 2017,117,2
16410,American Airlines plans to share part of Boeing 737 Max compensation with employees,117,20
9235,Hit-and-run charges dropped against Red Bull heir,117,37
1525,Alabama state offices closed Friday to mark Juneteenth,117,10
11535,"Due to Seattle’s 'unrest,' billion-dollar investment firm moving to Phoenix",117,116
5001,"SpaceX Mars rocket prototype explodes on landing, again",118,70
9120,More countries make face masks mandatory,118,16
3001,Oklahoma man gets over 3 years for smuggling guns to UAE,118,25
8962,Belarus poll workers describe fraud in Aug. 9 election,118,7
14632,Starbucks asks for a break on rent for the next year,118,74
16292,Hong Kong steps up response to mystery disease from China,118,14
11905,Bank of Engeland to remove any portraits of former governors linked to slave trade,118,30
5703,"New COVID-19 variant defeats plasma treatment, may reduce vaccine efficacy",118,33
11277,Another Christopher Columbus statue removed from N.J. city park,118,68
622,Refugee admissions to US the lowest in 40 years,118,16
6102,Olympics: Japan to ban entry of foreign athletes during virus emergency,118,16
11862,"Elon Musk says Tesla, SpaceX will honor Juneteenth as a US holiday",118,28
12336,Video: Beijing marketplace infections trigger ‘wartime emergency mode’,119,23
9847,Homeowner fatally shoots suspected intruder,119,135
12881,Walmart will stop putting ‘multicultural’ products in locked cases,119,61
13189,"N.S. woman was killed by her own dog while taking it for a walk, RCMP say",119,119
11021,India says China amassed troops along border in violation of agreements,119,17
14861,Norwegian Cruise Line warns of 'substantial doubt' it will survive,119,74
2930,U.S. airport passengers hit highest level since March 2020,119,15
9964,State Troopers ask for help identifying people shooting cars on I-5 in S. Oregon,119,31
4302,'Pivoting as the virus adapts': FDA says Covid-19 vaccine makers can modify shots as variants emerge,119,9
15703,Employees union files unfair labor practice charge against the city of Solvang following lay-offs,119,9
12046,Jeff Bezos tells everyone at Amazon to cancel meetings on Juneteenth and focus on learning about diversity and racism,119,48
15532,"Mom stole my weed, 14-year-old boy tells OPP",119,38
9282,"Russia has tested an anti-satellite weapon in space, US Space Command says",119,50
13870,Rental fleet collapse drags down U.S. vehicle sales,119,10
3900,"3 adults slain in Arkansas home, abducted baby found safe",119,13
2215,"Bo Schembechler’s son says he was abused by ex-Michigan doctor, and told his father",120,22
5509,Michael Strahan tests positive for COVID-19,120,13
11909,FEC to take public comments on petition to close ‘Bloomberg loophole’,120,8
5470,Bomb blast kills at least five people in northern Syrian town of Afrin,120,8
123,"CDC’s Covid vaccination rates appear inflated, experts worry",120,28
9921,A swarm of flying ants stretched for miles over the UK and looked like rain on weather radar,120,21
1829,Ireland doubles quarantine period for unvaccinated UK arrivals,120,6
116,Olaf Scholz elected to succeed Angela Merkel as German chancellor,120,25
16012,The Sun records £68m loss amid falling sales and hacking damages,120,27
12838,Man injured in toppling of Confederate statue in Virginia,120,67
5647,B.C. reveals age-based plan to complete vaccinations by September,121,1
1002,Florida mayor urges water limits because of COVID-19 surge,121,41
11147,"Kinder Morgan Sued Over Drilling Fluid Spill In Blanco County, TX",121,5
12505,Thousands attend Black Lives Matter protests across Australia,121,23
151,Congressional leaders reach deal to hike debt limit | AP News,121,29
8132,Rupert Murdoch’s News Corp Bids for Simon & Schuster,122,27
11357,"U.S. couple files lawsuit after barely surviving deadly New Zealand volcano eruption: ""We're very angry""",122,52
16163,Architecture school started by Frank Lloyd Wright to close,122,19
2414,Pride breaks with Halifax libraries after controversial book kept on shelves,122,225
8910,"Death toll in fires raging in West rises to nearly 30, with dozens missing",122,23
233,District: Missouri students posted slavery petition online,122,71
42,Holmes ends defense in Theranos fraud trial,122,32
16135,Arizona woman whose child was eaten by dog gets probation,122,58
379,Former Calgary police officer accused of running into suspect with patrol vehicle,122,7
8439,"More than 160 students, teachers nationwide hurt in science experiments gone wrong",122,55
7628,Hundreds of boats likely destroyed in Michigan marina fire,122,31
8214,U.S. Senate passes anti-doping sports bill,122,73
15408,Woman in Morgantown arrested for violating executive orders,122,66
8601,Swiss bank UBS says Toronto has the 3rd biggest housing bubble in the world | CBC News,122,23
14343,"Veritas, Rep. Nancy Pelosi at odds over real-estate company's $3.6 million PPP loan",123,7
5306,"As Google eyes Australia exit, Microsoft talks Bing with PM",123,62
2738,Over 100 arrests in UK police bill protest,123,13
3737,Russian diplomats push their way home with handcar out of North Korea,123,3
1988,'She was thrown to the ground': Police investigate attack on Muslim woman in Edmonton,123,5
5874,UN says breakthrough achieved in Libya transition talks,123,24
7199,"Christmas mixing curtailed, new tier 4 restrictions amid faster-spreading COVID variant.",123,14
9577,Giants' Alyssa Nakken becomes first woman to coach on-field in MLB game,123,14
371,Investigation Concludes USS Connecticut Grounded on Uncharted Seamount in South China Sea,123,25
4898,Influencers told not to use 'misleading' beauty filters,124,45
11332,Russian hackers Evil Corp target US workers at home,124,23
6570,Ugandans warned not to eat dead fish washed ashore,124,15
6698,Pakistan power blackout triggers ‘night mode’ memes online,124,1
14497,China goes after U.S. over more than $1-billion owed to the UN,124,167
8485,"EXCLUSIVE: Azerbaijan, Armenia 'near ceasefire deal' on Nagorno-Karabakh",124,8
16286,"New Orleans clerk of court announces near-total shutdown, furloughing employees and stranding inmates",124,25
2031,2 children caught in crossfire of quadruple Cincinnati shooting,124,116
12416,"London sisters were stabbed to death by Stranger, say police | UK news",124,15
10490,Russia cracks down on marmot hunting after bubonic plague alert,125,14
1294,"Officer, suspect exchange gunfire near Juneteenth parade in Michigan",125,24
4185,Square buys $170 million worth of bitcoin,125,72
11808,SAPD: 9-year-old stabs 12-year-old brother during fight over blanket,125,42
3719,Court awards $2.3 billion to US ship crew held hostage by North Korea,125,14
6139,Unexpected String of Allergic Reactions Causes Delays at ‘Vaccination Super Station' Near Petco Park,125,9
3041,New York doctor charged with five murders for alleged 'depraved' prescription abuse,125,16
5173,A Minnesota Case Marks the First Detection of the Brazil Coronavirus Variant in the U.S.,125,40
14559,Afghan maternity ward attackers 'came to kill the mothers',125,17
510,Jury finds American Ambulance liable for injuries to Fresno man,125,13
11820,March shuts down southbound I-5 bridge amid ongoing Juneteenth celebrations across Portland,125,42
4633,Denmark to build 'first energy island' in North Sea,125,11
2946,"Novavax vaccine 96% effective against original coronavirus, 86% vs British variant in UK trial",125,5
13960,2 Brooklyn attorneys granted bail in NYPD firebombing case,125,9
1697,"Title IX Protections Extend to Transgender Students, Education Dept. Says",126,29
6184,S Korea court upholds jail for ex-President Park Geun-hye,126,4
11580,"Michigan man wins $4M lottery scratch card game, again",126,11
16055,Dead Birds in Passenger’s Baggage Seized at Dulles Airport,126,42
9432,"3-year-old dies, sister in critical condition after found in hot car",126,51
8948,Hurricane Laura death toll: Excessive heat and no power blamed for 2 more deaths,126,11
9244,New Mexico deputies: Man killed following fight over mask,126,50
1804,FAA reportedly pausing Southwest flights as it works to fix outage,126,6
5507,Beloved Asian American photographer Corky Lee dies after bout with Covid-19,126,2
3666,Woman sues Utah youth facility amid sex assault allegations,126,6
14028,Rioters vandalise statue of Polish-US hero Tadeusz Kościuszko as violent protests erupt across America,126,79
15210,France's president says US and China back a world truce -- and he thinks Putin will 'definitely agree',126,48
8834,"11 people shot in 4 different incidents in Grand Rapids, Michigan",126,28
7560,SF D.A. Boudin charges SFPD officer for man’s Fisherman’s Wharf beating,126,14
2258,Bronx Woman Arrested After 7-Month-Old Abandoned at Brooklyn Deli,126,43
15884,Nazanin Zaghari-Ratcliffe freed temporarily from Iranian prison. British-Iranian dual national required to wear ankle brace and stay close to parents’ home.,126,3
15344,Ukraine: wildfires draw dangerously close to Chernobyl site | Chernobyl nuclear disaster,126,25
4738,Royal Dutch Shell sees huge loss as pandemic hits oil demand,127,14
10722,Swiss zookeeper dies after tiger attack inside enclosure,127,36
5276,Chinese submarine sailors report significant mental health problems in rare study,127,34
14821,"Uber to lay off 3,700 employees, about 14% of workforce",127,15
10827,Russia: 84 out of 85 regions back Putin in vote allowing him to stay in power until 2036 | World News,127,54
16345,Florida 2020 Python Bowl to offer prizes for eradicating invasive snakes,127,46
746,"China's vaccine faces scrutiny as Indonesians die despite shots, U.S. pledges donations",127,51
11516,Rhode Island moves to change state's official name due to slavery connotations,127,68
12508,Amazon's business practices examined by two U.S. states: reports,127,2
13641,Active-duty troops withdraw from Washington DC,127,26
220,Toys for Tots Collection Gone in Blaze,128,29
6839,Iran leader bans import of U.S. and U.K. made coronavirus vaccines,128,30
206,"Data suggests Omicron COVID-19 variant could overtake Delta worldwide, scientists warn - National",128,71
14564,U.S. state attorneys general likely to bring antitrust lawsuits against Google: source,128,22
14421,"FBI says Naval Air Station-Corpus Christi shooting was terror related, second suspect could be at large",128,18
12391,Police: 5 shot in Edgewood neighborhood in Atlanta,128,62
3609,"Lockdown bomb hoaxer targeted NHS, MPs and BLM protests",128,3
1685,‘Sad and troubled’: Police called after swastika painted on Edmonton mosque,128,41
600,Scientists Found a New Kind of Killer Whale | Hakai Magazine,128,15
5736,Indian govt offers to suspend farm reforms; farmers may call off protests,128,5
1679,"Capitol rioter used charity to promote violence, feds say",128,52
9653,"Former skater sues coach, federation over alleged sexual abuse and coverup",129,2
14541,NFL player Baker surrenders after robbery charge,129,71
15731,Simmons Wildlife Safari Park drive-thru sets records under pandemic,129,9
152,Student denied emergency relief in Nevada vaccination suit | AP News,129,74
10977,Another Round of Saharan Dust Is Headed For the U.S. Gulf Coast This Week,129,8
10646,Suspected jihadists fire on UN aid helicopter; 2 dead,129,4
13217,FCC awarding up to $16 billion to address U.S. areas lacking broadband service,129,27
15508,"Prosecutors: Arlington Heights intruders hoped to find $200,000 cash",129,46
9339,"Receptionist job in Manchester diner gets 1,000 applications in 24 hours",130,18
14360,Air Force 'Skyborg' AI powered drones to take flight alongside warplanes by 2023,130,76
11654,Italian team covers glacier with giant white sheets to slow melting,130,14
8576,"100,000 New Mail-In Ballots Go Out, but N.Y. Voters Are Now Wary",130,18
976,"Poison algae may have killed California family, police say",130,34
15300,"Ford expands making medical products, tags two Michigan plants",131,7
9219,Protesters try breaking into federal courthouse; federal officers respond with munitions,131,137
16477,Victoria police officers stop sexual assault while vacationing in Hawaii,131,6
6325,Dropbox to cut 11% of its global workforce,131,14
10485,Indiana officials investigate report of assault on Black man,131,64
15002,Cyberpunk 2077's former Polish distributor has filed for bankruptcy,131,37
9223,"Intel stock craters, investors ‘frustrated’ by new manufacturing defects",131,68
5966,"USDA unveils $2.3 bln in new COVID-19 aid, mostly for livestock farmers",131,29
587,‘Dystopian world’: Singapore patrol robots stoke fears of surveillance state,131,34
2724,"Virus Variants Threaten to Draw Out the Pandemic, Scientists Say",131,58
15743,"As the rest of Europe lives under lockdown, Sweden keeps calm and carries on | World news",131,124
12324,Seventeen-foot python put up a fierce fight before being captured in Florida Everglades,131,47
15250,"Police: NJ man broke into funeral home, stripped naked, left cold beer in casket",132,25
3701,Hundreds missing after gunmen raid Nigeria school,132,6
10461,Facebook prepares to dig in as advertising boycott continues,132,39
14326,Officer in video forcing man into wall to be disciplined,132,10
6329,"Imprisoned for nearly 48 years, artist and former boxer Ray Gray might finally see the light of day",132,16
11855,2 charged in Iowa assault that NAACP says was racist,132,16
1699,"Suns' Chris Paul tests positive for COVID-19, in health and safety protocols",132,51
3431,Myanmar army fires ambassador to the UN after anti-coup speech,132,3
13135,Protesters establish 'Free Capitol Hill' near East Precinct,132,17
956,Anti-lockdown protesters clash with police in Melbourne,132,27
8597,Red flag warning issued for parts of Northern California as crews battle Glass Fire,132,5
11050,Thousands of UK consumers can't access their cash because of Wirecard's collapse,132,20
12533,Canada spy agency warned of 'shock waves' from arrest of Huawei founder's daughter,132,44
6373,"Some Uber, Lyft drivers sue over California ballot measure",133,25
5242,"Amazon, Alphabet and Salesforce are all investing in a $28 billion company that crunches big data",133,21
3320,"India is now only 'partly free', says global report",133,26
108,"Better research into Instagram, WhatsApp effects on young users needed, academics say",133,26
9799,"Man killed, 8 others wounded in shooting in nation's capital",133,85
12531,Protest over Mexico police killing of Mexican-American teen,133,9
3943,Cherokee Nation Supreme Court issues decision that ‘by blood’ reference be stricken from Cherokee Nation Constitution,133,14
12313,2 planes collide in mid-air near Constance Bay | CBC News,134,15
10724,Former Philadelphia Phillies pitcher Tyson Brummett among 4 killed in Utah plane crash,134,13
6549,"Strong earthquake hits Mongolia with 6.8 Magnitude, 21:32:48 UTC",134,13
4501,MIT graduate named person of interest in murder of Yale student,134,11
5725,Ex-VW manager Schmidt gets early release from prison in diesel case,134,5
1553,"Uber-for-helicopters startup used a fake spokesperson for three years, CEO admits",134,20
1420,Man charged with killing security officer at basketball game,134,43
4367,Scam artists lurking on dating apps and social media made away with a record haul in 2020,134,34
11091,Montana man arrested after toppling religious monument,134,79
15711,"Mortgage bankers warn Fed mortgage purchases unbalanced market, forcing margin calls",134,41
1026,Controversial billboard allowed to stay up in Arkansas,134,104
7539,Chicago mayor apologizes to woman for wrongful police raid,134,35
12977,Pope Francis Sends Strong Message to U.S. Catholics After George Floyd's Death,135,29
8641,Charlottetown police fine 2 more party hosts for exceeding guest limit,135,14
4681,China promotes education drive to make boys more 'manly',135,80
700,Anti-vaccine protesters in New York chant 'save Australia',135,91
579,Police confirm Meth lab discovered at Bal Harbour high-rise,135,18
10080,Lawmakers slam Robinhood after apparent suicide by 20-year-old trader,135,99
5039,Oxford/Astrazeneca coronavirus vaccine shows sustained protection of 76% after First Dose during the 3-month interval until the second dose,135,6
6527,Parents charged with murder in lice-linked death get bail,135,44
16456,Operation Red Nose volunteers hit by alleged drunk driver New Year's Eve,135,33
15561,A zoo has been trying to get two pandas to mate for 10 years.,135,46
3027,"Kentucky Man's Body, And His Motorcycle, Found Below Grand Canyon's South Rim",136,54
612,"Winter Haven woman, 77, killed when front-end loader rolls over her car",136,19
13056,"Hong Kong police arrest 53 pro-democracy activists, more rallies planned",136,8
10192,On Your Side: Reno neighbor given cease & desist letter for recording deadly dog attack,136,53
9389,FBI exhumes body of man who died in 2004 to investigate possible hate crime,136,5
182,Norway again hardens COVID-19 curbs to try to halt spread,136,6
15414,OPEC and allies finalize record oil production cut after days of discussion,136,89
6007,Massive California off-road event to go ahead despite stay-at-home order,136,38
13326,Texas reports a record number of hospitalized coronavirus patients after state reopened early,136,30
3790,Airbnb reports huge loss in first time out as public company,136,57
7435,"Coca-Cola is cutting 2,200 jobs",136,46
9781,Residents of a Kenyan village awarded $12 million in a lawsuit over lead poisoning,136,4
5652,Man arrested in 3 slayings at NYC senior housing project,137,1
15031,Woman saved after breast implant deflected bullet away from her heart,137,34
3722,Malaysian man wins landmark challenge against Muslim gay sex ban,137,6
4674,China to Stop Recognizing Special U.K. Passports for Hong Kongers,137,19
2136,‘It worked out for the best’: Man helps moose calf over guard rail on Kenai Peninsula,137,8
9971,Texans WR Kenny Stills arrested at Louisville protest,137,5
409,The world promised to cut greenhouse gas emissions. These countries aren't meeting their targets.,137,29
6045,Covid: 'Convalescent plasma no benefit to hospital patients',138,4
10590,New Mexico’s suicide rate is highest in the nation.,138,49
9200,Feds accuse ex-Philly congressman Myers of stuffing ballots,138,66
9846,Thousands attend illegal rave at RAF Charmy Down near Bath,138,24
8863,Scientists 'make mini-heart from mouse stem cells',138,11
9323,"German court convicts former SS guard, 93, of being an accessory to murder at the Stutthof concentration camp",139,55
4512,"Rochester city schools stop serving students hot lunches due to layoffs, budget crunch",139,55
3173,Homeless man with flamethrower threatens gas station attendant,139,41
7305,Shark bites Florida man who walked home profusely bleeding,139,54
5393,"Three people, including a child and teenager, killed in a triple homicide in Minnesota",139,23
4927,"Thousands living in poor quality military housing, report says",139,28
