,title,score,num_comments
5287,"NJ unemployment: Workers can't reach claims agents, still desperate for help with benefits",2234,188
6669,Nearly 4 million Americans have been out of work for at least six months,2235,187
16091,Jeff Bezos’ net worth jumps by over $12 billion after Amazon’s big quarter,2238,731
1890,"US military guns keep vanishing, some used in street crimes",2241,386
16389,US manufacturing plunges deeper into recession,2245,452
4684,"Fake accounts gain traction as they praise China, mock US",2245,482
4365,"Someone Replaced the Toppled Harvey Scott Statue at Mount Tabor With a Monument to York, the Only Black Member of the Corps of Discovery",2250,200
1125,Investigator: Gunfire by Corona Costco shooter was not reasonable act of self-defense,2251,292
5825,U.S. Census Bureau director resigns,2252,107
1041,Judge orders that Larry Nassar's prison funds be turned over to victim restitution,2253,112
14720,Gov. Whitmer becomes target of dozens of threats on private Facebook groups ahead of armed rally in Lansing,2255,706
12611,Police union head resigns over post on accused officers,2257,102
6100,"More than 90,000 Americans could die of Covid-19 in next three weeks, CDC forecast shows",2259,408
1188,Lake Jackson man contracts flesh-eating bacteria twice while at Texas beaches,2260,201
7354,"1,000 people stuck overnight in Japan traffic jam stretching 9 miles long",2271,313
4115,SPLC: At least 160 Confederate symbols taken down in 2020,2271,400
14961,$500K bet on rock paper scissors ruled invalid by Quebec court,2277,217
9164,Masks rule goes into effect in England as Boris Johnson calls anti-vaxxers 'nuts',2277,177
330,Russian diplomat found dead outside Berlin embassy,2283,186
5853,Los Angeles becomes first county to hit 1 million Covid-19 cases,2285,215
1243,"Sudan to allow drinking alcohol for non-Muslims, ban FGM",2295,159
8403,U.S. hits 11 million Covid cases as restrictions increase and holiday worries mount,2311,271
958,"Judge strikes down California voter-approved law shielding Uber, Lyft from classifying drivers as employees.",2311,327
14109,'Just relax': George Floyd's brother condemns violent protesters,2320,319
188,Biden Vaccine Mandate for Federal Contractors Is Blocked Nationwide,2323,1332
12394,"New Orleans protesters take down statue of John McDonogh, toss it in Mississippi River",2325,422
2123,"China has created a ""dystopian hellscape"" in Xinjiang, Amnesty report says",2326,396
7671,Google workers mobilize against firing of top Black female executive,2328,736
5243,"ACLU, for first time, elects Black person as its president",2333,154
1545,"Brazil has 2,468 COVID deaths in 24 hours, nears half million toll -ministry",2357,163
6355,Climate activist Thunberg to appear on Swedish postal stamp,2364,151
1619,Over a billion records belonging to CVS Health exposed online | ZDNet,2365,207
4199,Member of Kansas City Proud Boys chapter to remain in jail,2367,71
16422,Sales of Manhattan's priciest apartments plunge almost 40% in fourth quarter,2373,505
1528,Ohio officer on leave after video shows her patrol cruiser running over gunshot victim,2388,403
11077,Postal worker caught on camera dumping campaign fliers.,2391,365
896,Miami Beach suspends law used against people filming police,2399,160
5318,"Andrew Brooks, who led development of the first FDA-approved Covid-19 saliva test, dies at 51",2405,108
14328,"US layoffs climb to 41 million, despite business reopenings",2408,275
2789,Nike denies involvement with Lil Nas X 'Satan Shoes' containing human blood,2416,552
8393,Washington state Gov. Jay Inslee announces new restrictions amid 'third wave' of COVID-19 cases,2427,220
3012,West Virginia man charged with stealing C-SPAN employee equipment during Capitol riot,2432,79
8734,"Live Nation to convert music venues into polling sites, links up with LeBron James effort",2433,99
8727,Ex-Arlington officer indicted for killing woman while trying to shoot dog,2435,407
10894,Carmel church pastor calls Black Lives Matter organizers 'maggots and parasites',2437,400
9362,The Boston Red Sox put up a Black Lives Matter billboard over the Massachusetts Turnpike,2445,313
759,Colorado university student arrested after bringing 'large cache' of weapons on campus,2446,636
10494,Army private charged in neo-Nazi plot to attack own troops pleads not guilty,2447,155
15919,"Amazon seeks to hire 100,000 to keep up with surge in orders",2451,294
5712,Florida man armed with Twisted Tea & metal pipe threatens former employer,2456,173
10832,Navy to sailors: Please stop buying LSD online,2458,448
1383,COVID-19: UK's longest-known coronavirus patient dies after choosing to withdraw from treatment | UK News,2462,321
2195,"Consumer prices jump 5% in May, fastest pace since the summer of 2008",2465,1124
16290,Former Wells Fargo execs may face criminal charges in coming weeks,2471,101
4141,Orlando launching pilot program to send mental health professionals to nonviolent calls for service,2473,158
3786,Washington high court strikes down law that makes unintentional possession of drugs a crime,2477,211
4793,N.Y.P.D. Anti-Harassment Official Fired Over Racist Online Rants,2479,158
8165,US Navy destroyer shoots down an ICBM in milestone test,2489,545
2681,Nike suspends endorsement of NFL star Deshaun Watson over sexual misconduct allegations,2500,423
12573,Woman charged for driving van into Indianapolis protesters,2500,217
692,"Vaccines may have prevented a quarter-million Covid-19 cases and 39,000 deaths among seniors",2507,147
15418,"Body-bag stocks are running out, suppliers say",2520,286
4106,"FDA Analysis of Johnson & Johnson COVID-19 Vaccine Finds It Safe, Effective",2521,317
6898,"Family of Mississippi man found hanged from tree file lawsuit to reopen case, attorney says",2526,94
15420,"Smithfield shutting U.S. pork plant indefinitely, warns of meat shortages during pandemic",2531,598
9397,More Wells Fargo customers say the bank decided to pause their mortgage payments without asking,2532,363
14319,Justice Department says inquiry into George Floyd’s death is a “top priority” after thousands protest — The Guardian,2536,415
92,Medical board deletes anti-misinformation policy amid GOP pressure,2538,296
13005,Corrections officer suspended over video mocking George Floyd’s death,2539,68
4756,Newsmax anchor walks off camera during MyPillow CEO Mike Lindell appearance,2541,310
4337,Bay Area gang member arrested after threatening to kill Asians online,2542,885
11324,Kosovo President charged with war crimes cancels White House visit,2543,161
9743,"Former Chattanooga Police sergeant charged with possession of meth, heroin",2552,100
572,California declares state of emergency in response to massive oil spill,2556,224
701,Pandora Papers: World leaders deny wrongdoing after leak of financial documents,2556,136
2598,U.S. Navy ship fires warning shots after close encounter with Iranian vessels,2564,394
889,"A major Einstein theory was just proven right, 106 years later",2578,372
12876,Federal judge rules ICE courthouse arrests are illegal,2587,76
2419,Edinburgh scientists invent game-changing cancer drug that can hunt down cells,2587,108
6859,"West Virginia lawmaker who filmed himself storming U.S. Capitol won't resign, his lawyer says",2590,274
11321,An ex-officer is charged with battery and official misconduct after video shows him Tasing a woman while his knee is on her neck,2598,102
575,"Twitch data reportedly leaks online including source code, streamer earnings, encrypted passwords, and more",2600,478
1105,"Child Covid-19 cases have 'steadily increased' since the beginning of July, AAP says, with 121,000 new cases last week",2602,498
13791,Trinity County deputy placed on administrative leave after posting George Floyd memes,2602,143
1327,F-22s respond again to Russian planes flying several hundred miles west of Hawaii,2616,576
3406,Amazon worker died by suicide at Las Vegas facility,2628,449
15098,"Man, 72, seriously assaulted on Baltimore bus after he wouldn't stop coughing, police say",2634,506
8773,Nearly all missing people accounted for as at least 35 killed in fires in US west,2637,87
6453,Mexico moves to create world’s largest legal cannabis market | Drugs News,2641,181
13912,"Looter fatally shot by gun shop owner in South Philadelphia, authorities say",2642,531
3319,Questions raised after Edmonton child predator re-released: ‘How many times is enough?’,2642,552
7127,"Modesto police released bodycam footage of an officer shooting, killing an unarmed man while performing a ""security check"" on Dec. 29, 2020.",2650,283
14730,United Airlines said it would try to keep middle seats empty. This photo shows a nearly full flight,2652,376
15902,Feds dropping case for 2 Russian companies in troll probe,2653,233
7185,United Airlines warns passengers of exposure after possible Covid-related death on flight,2660,408
14097,Hamilton County Sheriff: Office flew 'Thin Blue Line' flag after American Flag was taken,2668,411
16433,Rival Shi'ite leaders in Iraq call for U.S. troop expulsion in rare show of unity,2673,264
8940,"Two days after Hurricane Laura, a McDonald's business owner gave away 10,000 free meals from a portable restaurant",2676,72
14977,"Zoom gathering for African American students at UofSC interrupted by racist images, language",2684,663
15068,Fires near Chernobyl are making Kiev on of the most polluted city on earth right now,2691,129
1110,Three volcanoes are erupting at the same time in Alaska,2694,161
14244,Trump 'terminates' US contract with WHO: Coronavirus,2710,460
4701,Georgia man sentenced after trying to sell 50M nonexistent N95 masks to foreign government,2722,131
13848,Barr involved in decision to expand perimeter around White House and remove protesters,2723,163
5648,Lawsuit: Florida teen sues Twitter for alleged failure to remove child porn,2726,303
10413,Air Force veteran pleads guilty in scheme to offer information to Russia,2726,147
8057,"7 charged with stealing millions in Covid relief, spending it on Lamborghini and Porsche",2737,98
4423,"Cold, lack of water overwhelm Texas hospitals more than COVID-19 did",2745,131
12681,Nike to recognize Juneteenth as a paid holiday,2749,267
767,'Maderna' tourist wanted after skipping Hawaii Zoom hearing,2758,252
10784,Mexican state eyes closing US border as Arizona cases rise,2763,208
2929,"'Justice for Breonna Taylor': Events, rallies mark one year anniversary of Breonna Taylor's death",2775,201
2070,'Swallowed by the whale': Lobster diver caught by humpback whale off Provincetown,2788,321
7545,Florida pastor charged with possessing child pornography of children as young as 3,2789,239
5845,Christian denomination tells 'liberal' churches to be extra vigilant inauguration week,2790,393
1051,Connecticut Governor mandates vaccine for teachers and state employees,2803,151
2291,Carpenter faces $15M lawsuit for criticizing sexual harassment comments in construction podcast,2804,452
779,"McDonald's plans to ""drastically"" reduce plastic toys in its Happy Meals by 2025",2814,467
11691,United States Stands with Canada Against China’s Arbitrary Detention of Canadian Citizens,2819,261
10014,Montgomery school board votes to change the Confederate names of three high schools,2829,213
2495,"Ford to halt production of F-150, Bronco Sport and other vehicles due to chip shortage",2833,502
12031,Comedian Chris D’Elia accused of making advances on underage girls,2841,1130
6658,"After unused vaccines thrown in trash, Cuomo loosens rules",2842,327
5472,IG Group restricts trading on GameStop and AMC due to 'extreme volatility',2842,484
13455,Police back off as peaceful protests push deep reforms,2846,187
5934,Capital One fined $290M for ‘willful’ anti-money-laundering failures,2856,135
8030,Woman who cost parents custody of their children headed to prison,2864,444
2736,"Amid outcry, states push mental health training for police",2868,234
5371,"Facebook letting fake news spreaders profit, investigators claim",2874,130
13972,Nationwide Protests Against Police Brutality Megathread #5,2874,21816
6206,NY attorney general sues NYPD over Floyd protest response,2877,56
5794,Hundreds of children being admitted to Arizona hospitals for COVID-19,2879,288
2047,"Investigators digging under the house of a suspected serial killer on the outskirts of Mexico City said Saturday they have found 3,787 bone fragments so far, apparently belonging to 17 different victims",2888,170
4062,Postmaster General DeJoy apologizes for 'unacceptable' mail delays during holidays,2894,400
12605,"Black trans woman, Dominique Rem’mie Fells, found dead on banks of Schuylkill River | Philadelphia",2904,298
15270,Concrete room saves Mississippi family of 4 from twister,2922,407
4949,China blocks UN condemnation of Myanmar coup.,2929,236
4369,"In Letter, Former Officer Implicates NYPD in Malcolm X Death",2931,293
9645,"Portland Mayor Ted Wheeler says he’ll keep leading police bureau, city exploring legal action to address federal officers at protests",2949,635
1905,US intel report warns of more violence by QAnon followers,2950,650
12984,Investigation Shows National Guard Bullet Killed David McAtee | 89.3 WFPL News Louisville,2955,289
15007,Face masks to be compulsory across Germany,2963,350
7121,DC orders curfew after Pro-Trump protesters clash with police in Capitol chaos,2965,275
8473,Serious injuries reported in explosion at VA hospital,2965,143
9546,A black woman faces prison for a voting mistake. Prosecutors just doubled the charges,2966,694
3535,"Parents of 7 more separated migrant children have been found, lawyer says",2971,213
11811,'Armed individual' near Robert E. Lee statue in Richmond taken into custody,2972,194
5890,Hot Pockets recalled over potential glass and plastic contamination,2974,332
13244,Hong Kong protesters charged by riot police as they mark anniversary,2978,173
3618,Cat that vanished 15 years ago is reunited with owner,2982,181
5431,Toys 'R' Us has closed all its stores -- again,2984,293
1084,Most private insurers are no longer waiving cost-sharing for COVID-19 treatment,2994,593
6324,"The unemployment rate is above 20% for the lowest-paid workers, Fed's Brainard says",2999,253
9867,Police use drones to monitor nudity at Minnesota beach,3004,601
12742,Report: Amazon to be hit with antitrust charges as soon as next week over third-party seller data,3019,88
5785,All-female team delivers COVID-19 vaccines in harshest of conditions in rural Alaska,3024,226
5769,NBA star Kyrie Irving bought George Floyd's family a house,3043,289
10250,"Boy gets loaded gun from couch, kills little brother during 'cops and robbers,' police say",3047,1003
5614,Two police officers died by suicide after responding to Capitol riot,3050,541
15482,Military to send more troops into NYC hospitals to aid stressed medical personnel,3059,233
14847,US infection rate rising outside New York as states open up,3062,722
1368,"Apple Daily editor, CEO denied bail in Hong Kong",3069,134
13558,LA mayor announces end of curfews for 2nd largest US city,3072,238
15009,Tyson Foods idling its largest pork plant amid Iowa outbreak,3073,421
11998,Collier County deputy arrested on 100 counts of child pornography,3080,203
2126,Three Percenters militia members charged in U.S. Capitol attack,3088,223
3208,Georgia district investigating teacher who said Breonna Taylor deserved to get shot,3092,390
12312,"Florida sees 2 consecutive days of 2,000-plus new COVID-19 cases as more beaches reopen",3095,456
3478,'I'm in an operating room': California doctor performs surgery during Zoom traffic court trial,3100,342
576,"Whistleblower claims Bureau of Alcohol, Tobacco, Firearms and Explosives personnel were improperly paid bonuses reserved for criminal investigators",3108,163
7709,"Tampa Woman Will Finally Get Her $43,167 Back from the Federal Government - Institute for Justice",3110,188
1468,Pentagon releases guidelines on how troops can now sue the Defense Department for medical malpractice,3116,129
6626,Facebook halts political donations after Capitol riot,3118,185
5753,Pharmacist Accused Of Tampering With COVID-19 Vaccine Doses Charged With Misdemeanor,3123,234
6930,Suburban Chicago Man Charged After Riot at US Capitol,3127,229
171,U.S. boosters surge to all-time high on Omicron fears,3127,425
3593,NASA's DC headquarters is being renamed for 'Hidden Figures' scientist Mary Jackson,3140,47
6575,Gorillas test positive for coronavirus at San Diego park,3141,227
13683,"'No justice, no peace': Tens of thousands in London protest death of Floyd",3141,168
15924,First corona case confirmed in Greenland,3145,236
838,Georgia prosecutor confirms plan to seek death penalty in Atlanta spa shootings,3147,391
10964,Small town police chief given two week suspension for posting “protestors deserve to be run over like speed bumps” comment on page describe a vehicle attack against protestors.,3148,138
6695,"Bexar County Sheriff's Office jailer involved in events at nation's capital, sheriff says",3151,164
8417,New lockdown orders to hit Washington state on Monday as coronavirus cases surge,3151,322
1724,'Fentanyl has changed the whole landscape': San Francisco faces worst drug epidemic ever,3171,1046
13918,About 700 people arrested at New York City protests last night,3173,407
7482,"California, the latest epicenter, is reporting more coronavirus cases than most countries in the world",3187,619
15605,Japan PM Abe to declare state of emergency as early as Tuesday: Yomiuri,3188,238
8864,Chinese investment in Australia nosedives as distrust between two countries grows,3189,306
10083,"Airbnb asks people to donate money to landlords, backlash ensues",3189,659
2536,Florida Woman arrested in alleged Whopper-throwing racial tirade,3189,490
14626,Michigan forced to recognize right to literacy after students take legal action - Suit was brought by seven students in 2016 who argued they were deprived access to literacy due to lack of books and teachers,3195,155
2398,Arizona wants to use Zyklon B to execute inmates on death row,3195,1053
7489,"US jobless claims rise to 885,000 amid resurgence of virus",3208,456
374,Same-sex partners win survivors benefits after Justice Dept. dismisses lawsuits,3211,72
7651,Trump raises $200m for post-election legal battles,3213,639
7761,Nearly one out of four sailors from the Navy destroyer USS Michael Murphy test positive for Covid,3224,189
8436,Exclusive: Drugmakers offer Canada C$1 billion to scrap some pending pricing rules,3225,428
624,North Carolina school board bans critical race theory from its classrooms,3229,1201
3117,Study suggests strong link between obesity and COVID death rate,3231,536
2248,"Retired nun admits to embezzling more than $800,000 to fund gambling habit",3238,303
10924,Atlanta Hawks to transform State Farm Arena into massive voting station for 2020 elections,3240,99
2854,Drew Brees announces retirement from the NFL after 20 seasons,3245,223
3356,4 women who ran empowerment workshops killed in Pakistan,3247,180
8355,Thousands of Cars Form Lines to Collect Food in Texas,3251,789
16310,Fresh Cambridge Analytica leak ‘shows global manipulation is out of control’,3252,336
7469,6 men indicted in alleged plot to kidnap Michigan governor,3256,352
10052,Floyd family to announce civil lawsuit against Minneapolis,3261,178
12347,"Body cam footage of Rayshard Brooks’ death shows calm, then chaos",3262,3400
7237,Landlords are running out of money. 'We don't get unemployment',3274,2416
4533,U.S. election commission adopts nationwide paper ballot guidelines,3285,239
12648,Body Found Hanging From Tree In Square Outside Palmdale City Hall,3291,963
1209,"Home-grown, recreational pot get legal status in New Mexico",3292,151
13018,Gov. Ron DeSantis signs Dontrell Stephens bill | Palm Beach County Sheriff's Office on hook for $6 million payout after 2013 shooting left man paralyzed,3295,136
11843,"After heated exchange on race, Florida Rep. Matt Gaetz reveals Cuban ""son""",3300,726
4680,"Angry maskless man denied food service, returns with gun to steal fried chicken and waffles",3323,374
1364,George Mason pitcher Sang Ho Baek dies following complications from Tommy John surgery,3329,383
4169,"Ex-bank president in Texas gets 8 years for fake loans, arson to try to cover up fraud",3334,102
7857,"Military's system to combat sexual assault is broken, survivors say: ""It's so much bigger than it seems""",3339,147
4585,Canadian traces origin of AIDS to starving First World War soldier who hunted chimpanzees,3341,393
4330,"Revealed: 6,500 migrant workers have died in Qatar as it gears up for World Cup",3345,276
15648,Two children hospitalized after eating THC candy from a food bank,3350,1061
14293,Several police heads across nation condemn force used before Floyd death,3367,289
7267,Report: Airplane passenger with coronavirus-like symptoms dies after plane diverts to New Orleans,3370,841
12830,AFL players take a knee for Black Lives Matter at season restart blockbuster game,3385,80
11858,Video shows white man demanding N.Y.C. coffee shop take down Black Lives Matter sign,3397,445
433,Outrage after gay woman diagnosed at Spanish hospital with ‘homosexuality’,3405,358
4012,Prince Harry and Meghan donate new roof to Texas women's shelter damaged in storm,3409,214
14253,Charges Recommended Against 3 Officers Involved in Violent N.Y. Arrest,3412,141
7056,"Justice Department, federal court system hit by Russian hack",3414,95
5835,Apple CEO Tim Cook Tells Fox News Sunday: No Intersection Between Free Speech And Provoking Violence,3437,544
15837,US warns Americans against all overseas travel,3467,481
725,75% of U.S. adults have taken at least one dose of COVID-19 vaccine - CDC,3474,371
1977,Canada’s attorney general has initiated terrorism proceedings against the man accused of deliberately running down and killing four members of a Muslim family in what police have called a hate-motivated attack,3477,277
1196,UK bans fifth neo-Nazi group under terror laws,3488,448
5578,Owasso second grader expelled for telling another girl she had a crush on her,3497,676
3598,"Over 300 charged from more than 40 states: What we know about the ""unprecedented"" Capitol riot arrests",3498,423
15071,Healthcare workers protest for vital protection equipment,3499,238
9435,Outbreak at Iowa pork plant was larger than state reported,3501,191
868,Rev. Jesse Jackson Sr. and Wife Hospitalized After Testing Positive for COVID-19,3506,564
16465,Iran vows ‘harsh’ response to US killing of top general,3514,1685
14898,Tracking the ‘Murder Hornet’: A Deadly Pest Has Reached North America,3517,906
4909,Rights groups call for boycott of Beijing 2022 Winter Games,3517,264
4261,Plowy McPlowface Has a Shot in Naming Contest. ‘Abolish ICE’ Does Not.,3521,481
5374,Wall Street gears up for second bout against Reddit traders,3521,616
966,"Mississippi threatens fines, jail time for Covid patients who don't isolate",3522,227
4709,Boston's new Police Commissioner on leave after domestic violence allegation surfaces,3525,174
8093,Lawyers for Epstein victim seek 'previously concealed information' from Justice Department,3530,103
13852,Nationwide Protests Against Police Brutality Megathread #6,3530,17957
10031,Florida unemployment office reducing number of call center employees,3534,422
1620,"Fake coronavirus tests may have helped fuel Indian outbreaks. The Indian authorities launched an investigation after an internal government report concluded that some private agencies responsible for coronavirus testing on pilgrims at a sprawling Hindu festival forged at least 100,000 results.",3552,191
67,"Michigan sets pandemic record for COVID hospitalizations; stretched staffs feel defeated, disheartened",3552,643
9766,UK Chinese ambassador confronted on live television with Uighur prisoner footage,3553,242
750,"Average daily U.S. Covid deaths climb above 2,000 for the first time since March",3561,878
15635,Billionaire Brooklyn Nets owner Joe Tsai donates ventilators and masks to New York,3592,174
10660,Norman Police Department officers under investigation after allegedly releasing city councilmember's address,3594,211
3498,Indian man killed by his own rooster during cockfight,3596,339
14653,Fight erupts at Michigan Capitol over doll with noose around neck,3599,1080
939,Marine helps Afghan translator escape with family after week long struggle,3602,113
12074,New policy requires Montgomery county cops to intervene if fellow cop uses excessive force,3624,140
12622,Berkeley police chief apologizes for saying 'we can shoot people' as alternative to tear gas,3631,275
11684,NYPD officer in 'chokehold' video had prior brutality case,3646,97
1269,Video shows California deputy kicking suspect in head,3648,360
10723,"Grand Canyon hiker falls to her death trying to take photos, park says",3656,498
6502,U.S. to change Covid vaccine allocation to favor states that quickly administer shots,3659,250
400,US prisons face staff shortages as officers quit amid COVID,3670,415
15162,"Social distancing may remain in place until 2022, Harvard researchers say",3673,1982
14924,China is installing surveillance camera outside people's front doors ... and sometimes inside their homes,3675,545
3642,"Putin critic Alexey Navalny has been transferred to a penal colony, Russian prison service says",3679,209
2491,Rhode Island Governor Dan McKee Signs Legislation To Raise Minimum Wage To $15 An Hour,3679,353
12291,‘Canada’s first psychedelic-enhanced psychotherapy centre’ changing how we treat depression,3692,261
3910,Rare Yellow Penguin Photographed for the First Time,3697,141
8788,"'Hundreds of thousands, if not millions': New Mexico sees massive migratory bird deaths",3713,309
11693,Black bank manager wrongly arrested to sue Met for ‘racial profiling’,3718,144
13936,Alexandria's (Virginia) Confederate Statue Removed from Old Town Intersection,3718,183
7712,Tiger King star Jeff Lowe sued over 'inhumane treatment' of animals,3720,310
