,title,score,num_comments
6902,"Hunt for fake vaccine fraudster who injected and charged woman, 92, in Surbiton",361,10
1532,Motorcycle daredevil Alex Harvill dies in crash practicing for world record jump,361,261
15063,Spain to allow children outside after six weeks,361,110
2115,Third member of FDA advisory panel resigns over Alzheimer's drug approval,361,33
5627,Research shows oceanic shark populations have dropped 71% since 1970,361,30
14035,VIDEO: JR Smith Confesses Beating A Man For Breaking His Car Window Amid LA Protests,362,86
7272,US Space Force members will now be called 'Guardians',362,359
3153,VIDEO: State Rep. Sharon Har faces drunken driving penalties she helped write,363,29
499,Rio police say €3m Nazi trove found at home of child sexual abuse suspect,363,43
13034,Elderly Good Samaritan dies attempting to rescue child being swept away by river,364,19
6343,"Yellow mealworm safe for humans to eat, says EU food safety agency",364,185
11764,"Man charged with murder after pregnant woman, 3-year-old girl found dead in Baltimore",364,96
129,'Pharma Bro' firm reaches $40M settlement in gouging case | AP News,364,56
10968,US Secretary of State calls China Muslim sterilization reports 'shocking' and 'disturbing',364,52
10828,Charges filed against man who allegedly followed Black woman in Groveland,365,25
14865,India offers land to firms leaving China,367,64
1723,Ex-St Louis officer’s conviction points up revolving door for disgraced police,367,28
4321,‘Extremely promising’: 1st dose of COVID vaccine cuts illness,367,15
14668,One in four US workers claiming jobless benefits,367,114
7180,Judge gives Milwaukee's ousted police chief job back,367,91
9503,Cinnamon linked to blood sugar control in prediabetes,368,90
48,Coast Guard diver pulls body from car above Niagara Falls,369,20
15878,Fed launches 2 emergency programs last seen in 2008 crisis,370,64
12166,"20 Indian Soldiers Killed, More Than 40 Chinese Casualties in Ladakh Clashes",370,133
2635,Man arrested for trespassing on UofM campus with loaded rifle,370,96
1859,"COVID-19 Delta variant likely to become dominant U.S. strain, Gottlieb says",371,363
14756,Tesla Filing Lawsuit Against Alameda County After Decision Not to Reopen Businesses,372,349
14688,"54,000 still getting pay held over student debt, filing says",372,104
14007,Officials announce no charges to be filed at this time in the death of 22-year-old James Scurlock,372,92
11415,"""The Star Spangled Banner"" is out at Tulsa Athletics' home matches, ""This Land is Your Land"" is in",372,197
1935,UK alleged neo-Nazi Andrew Dymock found guilty on 15 terrorism charges,372,48
402,Police investigating desecration of Torah scroll at George Washington University fraternity,373,45
62,Inuvialuit want their kayak back from Vatican Museums,373,59
7839,McKenzie County (North Dakota) sheriff will not enforce the state’s mask mandate.,373,126
2390,Mass. Steamship Authority Hit by Ransomware Attack; Ferries Delayed,373,119
2039,Canada donating 13M surplus COVID-19 vaccine doses to developing countries,374,71
15469,Police: Miami officer handcuffed black doctor outside home,374,207
1959,Neo-Nazi ex-Ukip member jailed for 18 years for terror offences,374,24
15369,House lands on Georgia road after storm lifts it off foundation,374,65
6031,Capitol Police investigating bomb threat at Virginia Supreme Court building,375,14
14335,Suspect killed in Texas Navy base shooting identified as Syrian-born U.S. citizen,376,96
14751,Las Vegas police investigating after bag of dead dogs found,376,58
10078,"Mississauga man, 74, charged after used condoms tied to 9 parked cars",376,107
9540,Opelousas board fires white police officer accused of beating Black man in hospital bed,377,18
11192,Nigerian pop star allegedly abducts woman after she accuses him of rape,377,14
1408,Rabid dog imported into US sparks multi-state investigation,377,71
1255,"Live Updates: Tornado Hits Chicago Suburbs, Causing Massive Damage",378,26
1582,Portland police officers resign from Rapid Response Team,378,300
11074,NYPD cars hit with glass bottles and other debris in Harlem after responding to report of gunfire detected,378,185
463,Bonsai burglary wipes out years of hard work by Chino nursery owner,379,43
13390,Canadian tethered to 265 pounds of marijuana found unconscious in Detroit River,379,76
13531,Feds proceed with Chaco drilling plan while tribes distracted by pandemic,380,13
5995,No stockpile? Governors hit Washington as vaccine chokepoints pile up,380,33
2133,Child's body in sea in bag weighed down by anchor is 'girl kidnapped by dad',380,80
2431,Turkey Forcibly 'Repatriates' Nephew Of President Erdogan's Enemy: Report,380,15
9853,"David Kaiser, Rockefeller Heir Who Fought Exxon Mobil, Dies at 50",380,21
6666,"Spain paralyzed by snowstorm, sends out vaccine, food convoys",380,6
9400,"Former Cardinal McCarrick accused of participating in beach house ‘sex ring,’ lawyers allege",381,39
8724,White House to announce $11.6 billion aid for Puerto Rico,382,146
6862,"Scientists surprised to discover two dwarf giraffes in Namibia, Uganda",382,22
5163,Ocasio-Cortez Says She Is a Sexual Assault Survivor,383,238
13438,"After months at sea, the final cruise ship carrying passengers makes it home",384,38
11897,Mayor Schember Fires Erie Police Traffic Investigator Sgt. Jeff Annunziata Following Written Email Including Racist Remarks From Veteran Police Officer,384,34
3350,Thousands demand India's top judge quit over rape remarks,384,24
5918,Facebook blocks new events near key locations before U.S. inauguration,385,32
16517,"Suspect arrested after violent beating, apparent kidnapping is caught on camera in Las Vegas",385,29
8810,Attorney: Contractor got $454K for 'pile of dirt' at church,386,115
6404,'Super-Earth' found orbiting one of the oldest stars in the Milky Way,386,39
1933,CDC suspends import of dogs from countries with high rabies risk,386,109
11111,Spies and Commandos Warned Months Ago of Russian Bounties on U.S. Troops,386,37
9707,"Saudi King Salman, 84, admitted to hospital",387,75
15260,Family denied entry to storm shelter due to lack of face masks...,387,110
9564,"TikTok wants to hire 10,000 staff in the U.S. even though it’s at risk of being banned",388,140
4297,China arrests six for 'causing negative social impact' online over India border clashes,388,33
7050,California orders hospitals to take transfer patients amid devastating Covid surge,388,25
1748,899 People Received Expired Pfizer COVID-19 Vaccine Doses at Times Square Site,388,18
13138,A Missouri woman asked Merriam-Webster to update its definition of racism and now officials will make the change,389,109
13873,Red Cross Warns of a ‘Staggering’ Drop in Blood Supplies,389,45
1279,Bandit responsible for vehicle break-ins is a black bear,389,54
4543,Facebook under fire over encryption plans as man is jailed for abusing 52 children,390,92
4394,Update: Former North Side teacher pleads guilty to sexual abuse of 14-year-old student,390,128
15496,US man arrested after beating mom over toilet paper,390,117
3665,Man who attacked Jew in Germany sent to psychiatric hospital,391,65
1547,Bank of America gives WFH employees a Labor Day deadline to return to the office,391,289
12993,"California Highway Patrol's fatal shooting of man, 23, wounding of girlfriend probed",391,41
11568,"An 8-year-old girl, her mother and her grandfather were found dead in the swimming pool of a house they had just moved into",391,121
6114,Lawsuit: Iowa community college program was human trafficking,391,44
2179,Second UAW president sentenced to 28 months in prison in union corruption probe,393,86
12945,Seattle schools considers removing officers from campuses,393,59
10304,Walgreens strikes deal to open hundreds of doctor offices in stores,393,52
9660,Marriott Will Require All Guests To Wear Face Masks,394,41
16048,"Shipping business owners intercept magazine with $30,000 taped inside before it could be shipped to scammers",394,84
1429,"Shell company hijack: Men used SEC filings, fake press releases for stock pump-and-dump scam, feds say",394,24
8223,Governor Reynolds issues mask mandate in new health proclamation,394,32
8162,"Germany may cull up to 70,000 chickens after bird flu found on another farm",395,44
8493,"In the Netherlands, a Cartoon in School Leads to Online Threats and an Arrest",395,62
13997,Edmonton police launch review after officer posts photo of drug arrest,397,39
1464,"Record-shattering heat wave bakes western US, raising drought and fire concerns",397,72
15336,Doctor at Westside Regional temporarily loses custody of daughter amid pandemic,397,276
6927,"Rep. David Byrd Still On Ventilator With ‘A Long And Tough Road,’ Says Family Member",398,63
16312,2 Virginia McDonald’s Employees Shot After Drive-Through Altercation,398,106
9476,"Man kicks down door, shoots ex-girlfriend to death as she lay with 4-year-old daughter",398,155
1904,Iowa Man Is Sentenced to 10 Years in Prison After Mask Fight,398,148
15178,Body of Wisconsin child found in mother's vehicle is her missing son,399,71
8274,"Denmark culls 25,000 chickens after finding bird flu on farm",399,67
11819,'In tears': Protester dead in Burlington after being struck by transport truck at pig slaughterhouse,399,98
10402,Doctors say experimental treatment may have rid man of HIV,399,31
437,Universities ‘failing to mark down students’ for poor writing skills,399,97
8978,"Minneapolis mayor, police chief announce curfew; National Guard called in to address unrest in downtown area",400,143
14220,U.S. consumer spending tanks; savings hit record high,400,77
983,'Sovereign' Briton who refused to wear mask on MRT deported,401,61
6840,"Michigan man arrested at Capitol with pistol, ammunition feeding device, ""not a trumpster,"" says step father.",401,78
11274,Most U.S. Travelers Will Be Barred From E.U. When Bloc Reopens,401,134
5120,Exxon posts first annual loss as a public company on COVID-19 blow,401,74
4092,Biden administration will begin to admit migrants held in tent camp near the US-Mexico border,401,240
5420,BLM protesters file claims against SLO County District Attorney,401,75
817,Fusion gets closer with successful test of new kind of magnet at MIT start-up backed by Bill Gates,402,82
10760,George Floyd mural vandalized in downtown Spokane,402,246
7695,Sanford replaces CEO after controversial email about masks,402,27
7437,"344 kidnapped Nigerian boys freed, says state official",402,6
6806,Three arrested in India for beating endangered dolphin to death,402,35
10612,COVID-19: Thousands of cruise ship staff still stranded at sea,403,34
12483,NY Gov. Andrew Cuomo Signs Police Accountability Legislation,403,35
8028,Britain to ban new petrol cars by 2030 on road to net zero emissions,403,80
469,Studies confirm waning immunity from Pfizer's Covid-19 vaccine,404,170
5307,Ancient Jersey teeth find hints at Neanderthal mixing,405,41
8543,France sees flurry of arrests after murder of teacher,406,68
1124,Disgraced DEA agent sentenced to 13 years in corruption case,406,12
5867,Orphaned rhinos find refuge in S Africa sanctuary,407,7
15961,"US officials say US troops killed, injured in Iraq attack",407,106
15596,"Wisconsin election still on, but Supreme Court may intervene",407,83
1825,"Three stealth fighter jets just scrambled over Hawaii, and no one will say why",407,166
11571,"Powerful earthquake shake southern, central Mexico",407,32
2517,Southern Nevada Health District says former McDonald's employee spitting in customer's drink is a 'criminal act',407,34
11659,US moves to restrict Chinese media outlets as 'propaganda',408,58
14780,A bus driver told a rider to wear a mask. Then the passenger spit on her.,408,78
10745,Torrance Tirade: Woman seen in anti-Asian rant arrested for 2019 incident,409,68
2420,Oyster harvesting in Georgia to close for the summer,410,58
11914,U.S. prison riot teams faulted for injuring staff during exercises,411,21
8610,Judge orders Justice Department's police commission to halt work,411,23
14467,NASA human spaceflight chief resigns ahead of launch,412,105
5708,New Mexico zoo sends endangered wolf pack to Mexico,413,35
15419,"Tornado confirmed in Texas, damage from another suspected in Louisiana - CNN",413,40
9076,Singapore man admits being Chinese spy in US,413,26
16448,Paris stabbing: Man 'neutralised' by police in Villejuif,413,58
5015,"Tesla recalls 135,000 cars after pushing back against regulators",414,85
950,"Faced with a flood of COVID-19 patients, Queen’s Medical Center West Oahu has declared a “disaster” as the hospital seeks additional support",414,46
7285,"Teen stops domestic attack on mom, then is fatally stabbed",414,60
3047,Police: Dallas officer charged with 2 counts capital murder,415,30
2393,More US citizens apprehended for moving drugs over border,415,128
15183,NWS: More than 100 tornadoes hit from Texas to Maryland,416,70
7486,"Cherokee Nation upgrades criminal codes, redirects $10M for law enforcement, courts, prosecutors after McGirt decision",417,11
9576,NFL planning to allow social justice decals on helmets,418,230
9916,3 friends slain while preparing to fish at Florida lake,418,182
9018,Alabama's US Space and Rocket Center may close forever unless it raises $1.5 million in the next 3 months,418,113
8529,"Journalist murdered in Mexico, sixth this year: governor",418,5
1958,Thinner Mints: Girl Scouts have millions of unsold cookies,419,327
9992,"Small businesses rehire staff but cut pay and hours, survey finds",419,37
1579,New fossils of giant rhinos — the largest land mammals ever — are found in China,419,38
14801,AP Exclusive: US shelves detailed guide to reopening country,419,90
7296,US judge says parents owe son over trashed porn collection,420,279
15265,Factory shutdowns near WWII demobilization levels in US,420,46
10059,"Bay Area teacher caught with child porn sentenced to four days he already served in jail, probation",420,80
15361,"The trial of a former US marine accused of spying has begun behind closed doors in Moscow, 16 months after his arrest.",420,47
13019,Confederate monument in Virginia covered with trash bags,421,96
11070,UNICEF: 2.4m children in Yemen at risk of starvation,421,30
1144,Dog killed when owner locks it inside hot car as ‘punishment’,422,91
181,Cleveland Clinic Research Identifies Viagra as Candidate Drug for Alzheimer’s Disease,422,63
14996,"Sweden resisted a lockdown, and its capital Stockholm is expected to reach 'herd immunity' in weeks",422,803
5814,Church bells to ring across the nation in honor of COVID-19 victims,423,61
1463,"Lost brown bear in Japan injures four, breaks into military base and delays flights before being shot dead",423,36
696,Taliban Say Graduates Of 2000-2020 Of No Use: Report,423,172
14339,Father of 20-year-old patient who beat elderly man at Detroit nursing home says son shouldn't have been there,423,191
755,"Melvin Van Peebles, trailblazing director and Black cinema champion, has died",423,22
11938,"Lawsuit: Salt Lake City library security guards beat, kneeled on neck of black man",424,43
14799,Texas Supreme Court orders release of Dallas salon owner jailed for ignoring shutdown,424,280
16372,"Australia: Authorities believe worst yet to come amid loss of lives, soaring temperatures",424,41
6751,US lifts 'self-imposed restrictions' on Taiwan,425,66
14166,"Man dies after suffering ""serious injuries"" while being arrested for stealing a taxi in Delta BC. IIO",425,55
16335,Autopsy: Man fatally shot by Texas troopers struck 16 times,425,189
5721,North Carolina cities OK ban on hairstyle discrimination,426,101
14132,Minnesota attorney general to take over prosecutions in George Floyd's death,426,64
9450,AT&T tells customers to change their phones or they won't work anymore,427,184
10424,"Syracuse woman charged with molesting 5 children, raping 14-year-old boy",427,52
75,U.S. job openings jump to 11 million; fewer workers voluntarily quitting,427,237
1452,"3 dead, 2 missing after tubers go over North Carolina dam",428,111
8621,"Clergy sex abuse cases, COVID-19 push New York diocese bankruptcy filing",428,39
11708,Seattle Chaz shooting: police say violent crowd prevented access to victims | US news,428,408
12393,Buffalo teen who cleaned up after protests gets job offer,428,29
15405,Dwindling International Students Lead to a Domino effect in the Education Industry,430,149
2064,Controversial pastor Tony Spell ticketed for shooting alligator outside church,430,89
3516,CDC announces travel restrictions for countries hit by Ebola,430,73
2471,COVID-19 infections are exceedingly rare after full vaccination: CDC,430,105
1637,Alaska hiker reported missing after bear encounter found alive,430,22
10806,MLB cancels All-Star Game for first time since 1945,431,32
37,The AP Interview: CDC chief says omicron mostly mild so far | AP News,431,60
1332,Teacher suspended for showing a picture of the Prophet Muhammad fears returning to work,431,369
3707,Shamima Begum not allowed to return to UK,432,367
1359,Ethiopian leaders said they would ‘wipe out’ Tigrayans: EU envoy,432,70
1556,Gun rights and medical marijuana activists join forces in Minnesota,432,61
677,Crews race to avert ‘ecological disaster’ after California oil spill,432,56
4444,"Vandals target Kentucky’s local CBS, NBC, ABC, and iHeart Radio stations with messages over COVID-19 coverage",434,112
15410,"At least 6 dead after tornadoes, severe storms batter South",434,47
3145,"Texas power grid names firms with unpaid bills, cuts off second",434,57
11365,Red Rock Canyon Open Space permanently damaged after recent vandalism,435,208
1597,Therapy dog saves woman who was on the verge of taking her own life,435,40
10558,"UK sanctions Russians, Saudis under new Magnitsky powers",438,54
637,U.S. Capitol Police arrest man who parked suspicious vehicle outside Supreme Court,440,59
4822,"Ford receives a patent for a new, clear respirator mask that they expect to be just as effective as an N95",440,100
11025,DNA evidence points to 8-year-old's killer after 38 years,441,23
5812,"Troop levels are down, but US says over 18,000 contractors remain in Afghanistan",441,104
14278,Videos have surfaced where relatives of deceased woman Regis Korchinski-Paquet are claiming the Toronto Police threw her off of the balcony in a High Park apartment building,442,136
11629,Seattle mayor: Police to return to East Precinct after 3 weekend shootings in Capitol Hill,442,316
7728,Long Island City man exonerated for 1994 murder he didn’t commit,442,14
3069,Myanmar: police filmed assaulting medics in CCTV footage – video,442,18
1777,"If you can eat out, you can go to the office - says Morgan Stanley boss",443,349
15865,Angel Moroni atop the Salt Lake City Temple loses its trumpet.,443,200
14114,New footage shows moments before George Floyd was pinned to the ground.,445,78
2602,"Melting ice shifted the Earth's axis, scientists discover",447,55
2748,"France reports three new cases of thrombosis, more deaths after AstraZeneca jabs",447,249
14953,Girl Scouts in Alaska get federal recovery loan as cookie sales crumble,447,88
14468,Johnson & Johnson discontinues talc-based baby powder in US and Canada,448,84
11436,"Minnesota files climate change lawsuit against oil companies including Koch Industries, Exxon Mobil",449,6
6782,"Rittenhouse not violating bond after appearing at Mount Pleasant tavern, police say",451,389
5774,Mandatory paid sick leave related to COVID-19 expiring in 2021.,451,44
12436,Tulsa Police Investigate Officer After Remarks About Race and Shootings,451,18
4609,California surpasses New York as U.S. state with most COVID-19 deaths,452,73
13459,North Korea: Call from South to North goes unanswered for first time,453,37
8193,"SpaceX capsule, 4 astronauts dock at space station.",454,46
14597,Oregon Department Of Corrections To Dissolve Death Row,455,52
3607,Monarch butterflies down 26% in Mexico wintering grounds,456,28
7543,Robinhood accused of targeting novice investors with features that encourage excessive trading,456,123
2344,US man gets 30 years for murdering wife on ship,457,64
15164,"Bald eagles, eaglets found nesting in arms of Arizona cactus",457,34
667,New Zealand admits it can no longer get rid of coronavirus,457,157
6917,U.S. Capitol Police say reports of officer death not accurate,459,80
12619,15-year-old charged with setting fire to Boston police cruiser during city riots,459,117
5682,Eureka man arrested for making violent threats towards a government building,460,77
15109,SpaceX Crew Dragon to launch historic NASA astronaut mission on May 27,460,29
1722,New York grapples with growing presence of homeless in midtown Manhattan,461,427
12956,Israel's Supreme Court strikes down law legalizing settlements on private Palestinian land,461,53
7692,"Thanksgiving Day online sales hit record $5.1 billion, up 21.5% from last year, Adobe says",461,69
1048,Colorado’s federal wildland firefighters getting pay bump to $15 per hour,461,154
15562,Canadian town shares donated masks to sister city in Louisiana.,463,34
9832,A bank is paying people to bring in their spare change to help local businesses amid the coin shortage,463,94
610,Holly Hill woman says she never applied for $3.4 million COVID grant she's listed as getting,464,44
2922,Judge Allows Austin-Area Mask Order to Continue 2 More Weeks,464,55
3033,Tsunami warning for parts of New Zealand after 8.1-magnitude earthquake,464,26
3315,"Alamo Drafthouse files for Chapter 11 bankruptcy, to sell assets to Altamont Capital, Fortress Investment",465,86
5291,UCF fires professor who sent controversial tweets following complaints about classroom conduct,465,171
4895,"Man undergoes 1st successful face, double hand transplant from same donor",467,49
6463,Illinois man accused of threatening inauguration violence,467,28
1994,"A security guard is in critical condition after Atlanta mall shooting, police say",467,103
11159,Virginia man accused of burning cross at Black neighbors' home,467,86
6287,World's oldest known cave painting found in Indonesia,468,42
6843,Bailiff uses Taser on attorney in San Bernardino County courtroom,468,55
6090,Mars digger bites the dust after 2 years on red planet,468,38
11315,"Mexico City police chief shot in assassination attempt, blames drug cartel",468,25
8512,"Star Wars toys dumped in Stourbridge garage fetch £250,000",469,19
3188,Ex-Police Chief Charged With Attempted Murder After Arson Spree,469,20
6909,Hacking victim SolarWinds hires ex-Homeland Security official Krebs as consultant,469,24
12949,NASCAR to allow peaceful protests during national anthem,469,42
6010,Illinois National Guard activated to protect downtown Springfield ahead of inauguration,469,41
2833,U.S. housing starts fall to six-month low; building permits tumble,470,142
14744,"Ten shot, two dead in violent Saturday in St. Louis City",471,173
9393,FBI says it has evidence linking NJ judge family shooting suspect to Calif. murder,471,50
1850,Record rise in US wholesale prices over the past year,471,96
524,‘Dead because she was Indigenous’: Québec coroner says Atikemekw woman a victim of systemic racism | Indigenous peoples,472,55
6995,"Michael Jordan awarded $46,000 for 'emotional damages' following lawsuit against Chinese sportswear company",472,53
10539,"13 million gig workers getting unemployment benefits, 41% of the total",473,37
15488,Edmonton Oilers forward Colby Cave dies at age 25,474,33
15550,Saudi officials announce Yemen cease-fire amid pandemic,474,48
8045,"City of Flint, other defendants agree to settle water lawsuit as total boosted to $641.2M",474,47
13642,Greek demonstrators hurl firebombs towards U.S. embassy in Athens,476,57
8643,Counter-protesters sue alleged Proud Boys affiliates,476,106
15882,"Roger Mayweather, Floyd's uncle and former trainer, dies at 58",476,50
31,Father and son arrested for allegedly sparking Caldor Fire,476,60
1068,A California Family Dies Under Mysterious Circumstances. Toxic Algae May Be To Blame,478,129
11385,Michigan Teenager Died After Being Restrained at Youth Academy,479,7
9268,Walmart shopper charged with pulling gun during mask dispute,479,96
10180,Philadelphia to cancel all large gathers through February; Eagles are exempt,479,139
12068,South Korea says it will no longer tolerate irrational remarks by the North,479,74
65,Brazil soccer legend Pelé hospitalized for colon tumor,480,29
2079,Prosecutors say 10-year-old Justin Wallace was shot in heart as suspect is charged with murder,480,115
14115,"Police launch tear gas on crowds in downtown Spokane, WA",482,42
13402,Retired Navy captain apologizes after racial slurs streamed on Facebook,483,92
2819,Syria forced to ration fuel as stricken ship keeps Suez Canal blocked,483,34
16364,Australian bushfires: Sydney power under threat as fires destroy substations,483,31
10544,"Kaepernick, Disney announce partnership deal",484,258
225,Nearly 70 ICU medics at Spanish hospital COVID-19 positive after Christmas party,485,47
1321,Arizona police shoot suspect who struck multiple cyclists with vehicle,485,252
6413,The polar vortex is coming—and raising the odds for intense winter weather,486,100
11442,"Senators want public to see Pentagon UFO reports, citing ""inconsistent"" information sharing",486,98
14176,Arizona Gov. Ducey: Statewide emergency declared; curfew to take effect at 8:00 p.m.,486,112
5644,Taiwan reports large incursion by Chinese air force,487,100
14535,NASA Publishes Extraordinary Satellite View of California Wildflowers in Bloom.,487,34
5920,Judge: Alabama transgender license policy unconstitutional,489,57
15733,New York Attorney General Looks Into Zoom’s Privacy Practices,489,57
8844,"Sheriff in Georgia says deputy fired for ""excessive use of force"" during arrest of Black man",489,108
9618,"Armed man takes 20 hostages on bus in Ukraine, may have explosives",489,16
15499,"Flagler County woman placed 400 pamphlets, porn-filled Easter eggs in strangers’ mailboxes, deputies say",490,129
