,title,score,num_comments
2690,Durdle Door sea arch base jumpers &#x27;idiotic and irresponsible&#x27;,0,10
11256,Kansas State investigates insensitive comments made by student,0,27
8627,Honduras caravan heads towards US to escape pandemic-induced poverty,0,76
5002,Black Panther Director Ryan Coogler Is Creating a Wakanda Series,0,0
14773,"Consulate General of China donates meals to Monroe, Louisiana hospital",0,2
14354,NHS may need to hire airline staff,0,0
14795,"Critical situation, knife fight on board of container ship with dozens of migrants",0,17
16125,First love on the front lines: Coming of age in the Hong Kong protests,0,0
10320,One Million People Sign Petition to Shut Down Pornhub for Alleged Sex Trafficking Videos,0,71
13803,Joel Olsteen marched with thousands of other Texans for George Floyd today.,0,38
7763,They Championed Venezuela’s Revolution. They Are Now Its Latest Victims.,2,6
10978,'Dungeons & Dragons' Tries To Banish Racist Stereotypes,2,175
9894,Naples man dies in boating accident off the Florida Keys on Friday night,3,0
2564,Sneakers from Michael Jordan's rookie season up selling at Sotheby's,4,11
3850,Man charged with child rape volunteered with senior college,4,1
16366,Wang Zhimin loses job as liaison office chief,4,2
16148,Former NHL goalie arrested in Bowling Green,4,11
12641,North Korea questions need to 'hold hands' with US,4,5
9500,Fiat Chrysler and Waymo sign exclusive deal on self-driving commercial vehicles,5,0
11208,Megan Rapinoe praises NWSL players for kneeling during national anthem,5,13
14555,JCPenney buys itself a little more time,6,7
13025,U.S. companies vow to fight racism but face critics on diversity,6,4
16420,Carlos Ghosn escaped with help of rogue employee - jet firm,6,5
4180,COVID-19 Pfizer vaccine incorrectly administered to two patients at Brisbane aged care home,7,17
16287,Memphians protest against possible war on Iran,7,14
14665,Tesla's secret batteries aim to rework the math for electric cars and the grid,7,11
13033,Police investigating double shooting Petersburg,7,0
3390,Fauci presents his personal virus model to Smithsonian,8,7
10056,Crunch time for Apple in fight against $21b EU tax order,8,1
1132,"Tokyo's Olympic fears give way to acceptance, to a point",8,4
4894,Bebo chief reveals plan to take on Facebook and Twitter,9,5
5007,SpaceX Starship SN9 crashes and explodes upon re-landing,9,1
3678,Iran threatens to end deal with IAEA over U.S.-led push to criticize it,9,17
13023,"Mortgage demand from buyers amazes again, now up 13% annually",9,23
14567,"UN, WHO work with Assad to starve eastern Syria of aid during pandemic",9,13
4212,Jews split over storied charity’s support for settlements,9,2
10331,Prosecutor: Fireworks stand attack may be racially motivated,10,3
4183,Plane crashes on Lake Martin,10,0
3834,Thousands rally for Pashinyan as Armenia PM slams ‘coup attempt’,10,1
3957,UK 4G smartphone owners may be due Â£480m pay-out,10,1
5406,Mellon Foundation to Fund Diversity Programs at Library of Congress,11,1
12143,N.Y. Gov. Cuomo gives OK for US Open to be held in August,11,2
12821,Two people died in an incident at the primary and secondary school on M.R. Stefanik Street in Vrutky. (Slovakia 11.6. 2020),11,0
9990,"Iran, China deal to ditch dollar bypass US Sanctions.",11,26
3946,Dalit Labour Leader Shiv Kumar Tortured In Custody: Govt Doctors,11,0
2831,"4 killed, 1 wounded in shooting in Phoenix home, police say",11,2
16081,Pro-polygamy cleric in court for ‘insulting women’,12,5
14516,Pac-12 Football: Former Stanford Player Zach Hoffpauir Dies at Age 26,12,0
4156,"Afghan peace talks resume, but path is anything but certain",12,3
11018,China defence ministry says recent border clash caused by India,12,7
5456,Farm law protests: Delhi Police detain journalist Mandeep Punia from Singhu border,13,1
10175,UN court rules in Qatar's favor in aviation boycott case,13,0
12969,"IOC, Tokyo Olympic organizers agree to simplified games",13,3
12658,Child seriously injured in parking garage gate accident,13,1
3207,Israel suspects Iran connection to Mediterranean oil spill,13,15
9732,Trader Joe's to change product branding after petition calls it 'racist',13,98
13150,North Korea vows to develop chemical sector for self-sufficient economy,13,7
16197,"National arugula shortage due to wet, cold growing conditions",13,9
16178,China vows to beat 'devil' virus as countries rush to evacuate citizens,14,7
16151,J.Crew Group appoints former Victoria's Secret executive as CEO,14,9
11569,Twitter apologises for business data breach,14,2
1404,‘Targeted for violence’: the dangers LGBTQ+ Native Americans face,14,25
13273,Beijing warns students about going to Australia,14,3
4545,"Report: Racist Virginia laws are gone, but inequities linger",14,9
14565,Family Of Man Shot In Beavercreek Walmart Settles Suit With City,15,7
14608,Asian Paints to go ahead with salary hikes; no lay offs so far,15,7
9387,Attorneys seek to move 'Miracle on Ice' hockey star Mark Pavelich to less restrictive facility,15,1
3523,Bangladesh under ‘no obligation’ to take stranded Rohingya: FM | Refugees News,15,10
9931,Black members of St. Charles Borromeo Church in South Philly allege racism and will protest to declare their ‘parish lives matter’,15,11
3284,Hunger striker: U.S. base landfill soil mixed with WWII remains : The Asahi Shimbun,15,10
4345,"Racine Unified School Board discusses in-person learning, teachers union urges caution",15,25
10114,Malian accused of war crimes refuses to enter plea at ICC,15,2
4818,Sputnik V COVID-19 vaccine candidate appears safe and effective,15,21
12618,Man charged in deputy ambush scrawled extremist 'Boogaloo' phrases in blood,16,39
1810,israeli nationalists march through Jerusalem's Old City,16,38
9141,The strongest storm on the planet moves toward Hawaii,16,37
11027,Lesotho's former first lady granted bail in murder case,16,1
3956,Syria war: Russian jets 'bomb IS positions in desert region',17,2
9378,"1 dead, 1 injured at mall shooting in St. Louis suburb",17,3
9383,"Goldman Sachs joins NBA stars Carmelo Anthony, Chris Paul and Dwyane Wade to create Social Change Fund",17,6
12823,Louisiana Third Circuit upholds convictions of Marshal Brian Pope,17,0
13754,Sources: NBA to approve plan for 22-team return,18,11
4008,Covid: Fears college students 'struggled more' in lockdown,18,17
3968,"Indian Govt asks people to register as cyber crime volunteers, check unlawful online content.",18,5
13472,Finland launches new 5G spectrum auction,18,1
4110,Time is running out to enter the Inspiration4 contests for a SpaceX rocket trip,18,2
10726,Noose found in building owned by elite university,18,38
4657,UN calls for Bangladesh army probe after Al Jazeera investigation,18,1
10048,Apple wins case against EU €13bn tax ruling,18,3
9516,"NFL, union agree on daily testing for start of camp",18,5
3655,Niger’s President-elect Bazoum rules out power-sharing,18,0
10093,Tunisian court sentences blogger to six months in prison for reposting joke written in Koranic style,18,5
3182,Oklahoma prosecutor urges panel to reject inmate's claims,18,5
4127,"A Digital Firewall in Myanmar, Built With Guns and Wire Cutters",19,0
10195,Amazon unveils shopping cart that knows what you’re buying,19,30
12820,Turkish court sentences U.S. consulate employee Topuz to jail: Anadolu,19,0
4328,The Muppet Show: Disney+ adds content warning of 'negative depictions of cultures' | The Muppets,19,79
3107,"A New League’s Shot at the N.C.A.A.: $100,000 Salaries for High School Players",19,51
9444,Santa Fe school counselor accused of racism back at work,19,9
9895,"An armed robbery suspect was shot by police after pursuit on U.S. 1 in Keys, cops said",19,7
3550,India tightens regulatory grip on social media companies | Censorship News,19,0
16248,Hezbollah: U.S. forces in Middle East to pay price for Soleimani killing,19,21
3916,New US envoy to UN gets red carpet welcome from Russia,19,5
11207,L’Oreal to remove words like ‘whitening’ from skin products,19,89
11222,Bomb blast kills 2 Afghan human rights commission staffers,19,0
16161,China demands apology from Danish newspaper for 'satirical' coronavirus cartoon,19,20
9991,LA Pride leaving West Hollywood next year,20,6
11005,"World’s First Robot Restaurant Complex in Guangdong, China",20,7
11264,Luckin Coffee moves to remove chairman after accounting scandal,20,3
9428,Microsoft may face EU antitrust probe after Slack complaint on tying practice,20,1
16449,Berks: 'Myriad of inaccuracies' in ICE center review,20,4
3169,UK signs Trade Partnership Agreement with Ghana,20,0
12709,Old photos of 'student slave auction' at B.C. school ignite outrage online,20,24
12201,"U.S. Companies Can Work With Huawei on 5G, Other Standards: Commerce Department",20,0
16270,UK could forfeit security council seat over Chagos Islands dispute,20,6
3386,Bougainville's President won't be deterred from independence from Papua New Guinea,20,0
16132,Washington: Seven arrested in Snohomish County ‘Net Nanny’ operation,20,2
3370,U.S. working with allies on COVID-19 vaccine strategy in Asia to counter China: FT,20,1
11213,Russian Cybercrime Boss Burkov Gets 9 Years,21,0
9081,US banks can now offer crypto custody services,21,9
11266,"2 dead, 1 hurt in Illinois warehouse shooting; suspect dead",21,5
9317,"Ice cream in, personal hygiene out in lockdown",21,11
9399,Faith Refuge offers kennels for client’s canine companions,21,3
9084,"U.S. fighter jets fly near Iranian passenger plane, state media says",21,10
12518,Butler man sentenced to 5 years probation for child pornography charges,21,3
10570,EU threatens escalation in tariff fight over Boeing and Airbus subsidies,21,1
12801,Apple Pulls Pocket Casts Podcast App in China,21,1
9738,Total of four teens now charged following racist graffiti incident in Adirondack community,21,2
13148,"Nasdaq tops 10,000 for the first time ever",21,44
3294,Auckland lockdown threatens to split 'team of five million',21,3
5003,Black Panther Director Ryan Coogler Is Creating a Wakanda Series,21,4
11861,Boston police render aid to man who slashed himself with box cutter on Boylston Street,21,43
8705,Unity Software's shares soar 44% in NYSE debut,21,5
2851,Group reports health facilities looted in Ethiopia's Tigray,21,0
13000,The Latest: Contract workers stage Paris flash-mob protest,21,0
14418,"Three injured in Arizona shooting, police say",21,5
14441,Australian Courts finds some casual workers are entitled to paid leave,21,0
13313,N. Korean soldiers involved in DMZ shooting face light punishment,22,4
8701,UK will review how to license North Sea production while achieving net zero emissions,22,0
9370,Lawsuit: Officer fired over McClain photo denied hearing,22,4
9569,"David Leong, inventor of Springfield Cashew Chicken, dead at 99",22,7
2861,Saudi Arabia announces changes to Kafala system | Human Rights News,22,5
4218,H2GS plans 5MT hydrogen-based steel plant in Sweden,22,1
4157,Woman accused of ordering Forest Park grandmother's murder,22,1
9483,Scientists accidentally create new hybrid fish - CNN Video,22,14
16185,"Fotis Dulos, accused in estranged wife's murder, attempted suicide: Attorney",22,5
12155,Utah man accused of killing Tinder date pleads not guilty,22,1
12116,Microsoft's Github is removing coding terms like 'master' and 'slave',22,69
3847,"India, Pakistan agree to stop cross-border firing in Kashmir",22,1
12335,State Street in Montpelier vandalized,22,2
16343,Building partially collapses in French Quarter on Toulouse,22,12
10363,Turkish intervention in Syria is part of Erdogan’s regional ambitions,22,1
3824,"China lays down another marker in the offshore wind sector, accounting for half of last year's installations",22,4
10463,Owner's Racist Social Media Post Draws Ire,22,16
3157,"Mediterranean oil spill is ‘eco-terrorism’ by Iran, Israel says",22,31
16128,"At Harvey Weinstein’s trial, a big role for other accusers",22,0
3939,Armenian armed forces demand resignation of Prime Minister Nikol Pashinyan - ABC News,23,0
10143,"Fed' Brainard warns US economy may slow, urges more support",23,8
4429,"Short of Vaccine, States Find Hidden Stashes in Their Own Backyards",23,1
1550,"Over 300 cases of heart issue after Covid vaccination reported in young people, CDC says",23,74
3561,Processing of asylum seekers expands at US-Mexico border,23,1
4148,"Israel Gives Vaccine to Far-Off Allies, as Palestinians Wait",23,57
16304,The American Kennel Club announced two new dog breeds: the barbet and dogo Argentino,23,69
14451,"1 injured in shooting at Naval Air Station Corpus Christi, suspect neutralized",23,1
8801,"China is watching — Political Establishment: 5 PMs, two dozen CMs, 350 MPs across all parties dominate key influencers tracked",23,1
3402,"China's Nio wants to expand overseas, but there are roadblocks ahead",23,11
3935,'Like a bad joke': Al Jazeera staff bemused at rightwing US venture,23,14
12653,French police stage protest on Paris' Champs Elysees,23,8
11116,Home Office urged to investigate treatment of asylum seekers in Glasgow,23,3
16037,"Controversial anti vaccine documentary, set for secret screening in Edinburgh.",24,30
13131,Behind-the-scenes cop brings strong community ties to his role as Portland’s new police chief,24,0
10596,Police investigate deadly triple near southwest Atlanta Wendy's,24,21
4865,COVAX sets out plan for global distribution of 337m vaccines,24,2
4641,Syria says it responded to ‘Israeli aggression’,24,21
13862,Trading Standards squad targets anti-5G USB stick,24,10
8792,Pursuit Travels From OC to LA as Driver Hangs Out of Van Window and Blows Kisses,24,4
11354,BBC News - Jonty Bravery: Tate Modern balcony teen 'smiled' after attack,24,9
2537,Investigation follows after photo of a racial slur on a school project,24,9
10015,Kurdish language teacher sentenced to 10 years in prison in Iran,24,0
3990,IAEA to work with Japan on wastewater disposal | NHK,24,4
15032,Strong earthquake rattles Japanese islands,24,1
10049,"Islamic activists halt construction of first Hindu temple in Islamabad, Pakistan",24,11
3128,Rajasthan: Father allegedly kills 18-year-old woman for live-in relationship with Dalit man: India,24,14
11295,Zuckerberg: Facebook will prohibit hate speech in its ads,24,47
4332,Bharti Airtel ties up with Qualcomm for 5G services in India,24,0
644,Astronaut Barbie doll jets off on zero gravity flight,24,4
16336,NATO suspends Iraq training mission after killing of Iranian general Soleimani,25,2
13516,Victoria's Secret UK arm goes into administration,25,6
3891,India's arrest of activist tied to Greta Thunberg's movement sparks outrage,25,0
3388,"Kei Ju Farm owner charged with caring for wildlife without permit, animals killed by DNR",25,17
11584,Yemen southern separatists take control of Socotra Island,25,2
2200,New Coronavirus Spike Grips Siberia – Reports,25,2
3986,Paterson pays DPW supervisors 60 consecutive hours — each — of snowstorm overtime,25,2
14315,Houdini Heifer: farmer places ad looking for missing cow,25,8
5139,"MLB Players Reject Delay, Vow to Start Season on Time",25,17
7540,Judge approves Chapter 11 plan for Tonopah Solar Energy,25,11
11631,"Gadi, Australia's new supercomputer, ranks 25th most powerful in the world",25,5
5471,EU to publish revised rules after Covid vaccine border fiasco,25,0
3382,(Australian Attorney General) Cabinet minister Christian Porter strenuously denies historical rape allegation,25,2
13161,Exclusive: Oil tankers turn away from Venezuela as more sanctions loom,25,0
16171,Wuhan seafood market may not be source of novel virus spreading globally,25,6
9297,Italy detains Ocean Viking migrant rescue ship,25,7
4598,Covid-19: 10-year jail term for travel lies defended [UK][BBC],25,3
10452,Magnitude 6.6 earthquake rocks Indonesia; tsunami unlikely,25,0
16176,Tsunami threat message issued after magnitude 7.7 earthquake off the coast of Jamaica,25,6
14659,Tens of thousands under lockdown evacuate as Typhoon Vongfong strikes Philippines,25,1
8893,Theatre and arts prepare to return in a post-COVID world,25,16
7184,Chicago-area hospital halts COVID vaccinations after 4 workers have adverse reactions,26,92
3140,Decline in UK covid rates slowing with possible increase in some areas study,26,9
16326,Tractor-trailer smashes into home in Pennsylvania,26,12
13937,Speculation surrounds Iran scientist release after US detention,26,1
3764,Birmingham canalside assault leaves athlete 'in shock',26,7
13780,U.S. factory orders extend decline in April,26,0
8930,Sushant Singh Rajput: actor's death fuels media frenzy in India,26,4
9254,Double life of Bradford teacher who was a wartime spy,26,0
9551,Federal authorities answer questions about role in Portland,26,36
3137,Covid-19: Updated vaccines can be fast-tracked like flu jabs,26,1
4643,New Iberia City Marshal arrested on malfeasance and forgery charges,26,6
4142,Iranian regime shoots fuel traders causing revolt in Saravan,27,2
3366,Boeing cites risks in design of newest Airbus jet,27,13
13477,Arctic Circle oil spill: Russian prosecutors order checks at permafrost sites,27,3
9384,AP Exclusive: Aid from top donors drops even as need soars,27,3
11015,Authorities: 2 shot at Amazon facility in Florida,27,9
9110,Thieves emptying ATMs using new form of jackpotting,27,8
8183,"NXP, Amazon partner to connect cars to cloud computing services",27,16
10338,Milton firms up anti-mask stance by rejecting resolution to encourage mask wearing,27,14
10471,County leaders hope to shut down nightclub after fatal shooting,27,0
8966,"Portugal Communist Party Gets OK for 16,500 People at Event",27,2
3348,Daily Mail owner buy new scientist magazine for £70m,27,17
3524,Tokyo 2020 committee to pick at least 11 women to join board: media,27,10
3783,Ex-cop appeals murder conviction to Minnesota Supreme Court,27,2
11396,USDA Shells Out Another $228 Million in CFAP Payments - AgWeb,27,2
16204,Health officials 'confident' first case of coronavirus has been found in B.C. | CBC News,27,1
9218,"South Sudan activist flees to US, says Kiir wanted him dead",28,2
12134,African boy Iliass Tahiri Killed in Spanish Detention,28,2
16531,Family kicked off plane because daughter threw up before take off forced to cancel vacation,28,55
3565,UN Special Rapporteur Blasts ‘Devastating’ and ‘Illegal’ US and EU Sanctions against Venezuela,28,19
10473,Brazil registers most Amazon fires for the month of June since 2007,28,2
14845,India at 142 in World Press Freedom Index over Kashmir Blackout .,28,2
12797,George Floyd death: Al-Qaeda tries to exploit US unrest,28,17
16180,"3 more cases of infection with coronavirus are confirmed in Bavaria, Germany.",28,3
3163,"Yemen’s Houthi forces fired a missile at a Saudi Aramco facility in Saudi Arabia’s Red Sea city of Jeddah, a Houthi military spokesman said in a Twitter post on Thursday.",28,1
4832,Covid: UK 'past this peak' but infections still 'alarmingly high',28,1
9861,Brighton Royal Sussex hospital staff member injured in stabbing,28,0
14662,Brush fires shut down portion of I-75 in southwest Florida,28,1
13403,Pressures increasing on Indonesia and Malaysia in the South China Sea,28,2
9717,Dyess airman arrested for child sex crime,28,0
10862,Ship drawing sheds new light on Amsterdam's role in slave trade,29,4
9274,Search Ends for Remains of 1921 Tulsa Race Massacre Victims,29,8
12545,Justice: Visitation can restart at nursing homes June 17,29,11
1851,Sri Lanka grants bail to captain of disaster-struck cargo ship,29,1
11954,Berlin car race death: Top German court partially upholds murder conviction,29,11
13659,Comcast users facing internet outages throughout the area,29,9
4177,China regains slot as India's top trade partner despite tensions,29,16
12282,"Nation files lawsuit against Benally, alleging illegal hemp operation",29,1
4740,UK and EU in 'constructive discussions' over NI trade row,29,3
12194,Apple faces two EU anti-competition probes,29,1
3799,"AT&T Inks Deal For DirecTV With Private Equity Firm TPG; WarnerMedia Parent Will Retain 70%, Net $7.8 Billion In Cash",29,3
3731,Armenian Prime Minister says he is facing an attempted 'military coup' after army demands his resignation,29,1
4055,"Turkey sentences pilots, airline official over Ghosn escape",29,0
11432,Marketing gaffe: Sobeys pulls 'Sweet Sixteen' candy from shelves amid complaints,29,12
13608,Las Vegas casinos reopen with new safety measures,29,10
10295,MOCAD Director Placed on Leave After Staff Allege Racism and Sexism,29,3
12585,"Bomb in Pakistani City of Rawalpindi Kills 1, Wounds 15",29,0
3909,"IOPC investigates five Thames Valley police officers over death of man, 24",29,1
3750,Maryland man pleads not guilty to bringing loaded gun to Capitol insurrection,30,45
2940,Cluster of the UK COVID-19 variant infected several at the University of Memphis,30,1
9104,Hagia Sophia: Former Istanbul museum welcomes Muslim worshippers,30,12
16520,Attempted murder of off-duty officer investigated by PSNI,30,0
11008,Washoe County DA Determines January 2020 Sparks Police Officer-Involved Shooting Justified,30,3
4824,MP Margaret Ferrier appears in court accused of Covid rule breach,30,2
7762,Morton School Board Balks At Winter Sports 'Pause',30,13
1542,Banned runner still in Olympic trials lineup pending appeals,30,5
3882,"'Targeted, external attack' of Cobb County School's emergency warning system",30,1
3238,Health Canada allows more flexible storage and transportation conditions for Pfizer-BioNTech COVID-19 vaccine,30,0
12843,APD asking for help identifying woman who is believed to be victim of violent crime,30,3
3690,Biden marks 50M vaccine doses in first 5 weeks in office,30,102
14443,Southern and Western Regions Experienced Rapid Growth This Decade,30,1
1656,Bezos-Backed Fusion Startup Picks U.K. to Build First Plant,30,14
1878,"EU, U.S. set to unveil truce in 17-year aircraft battle",30,5
12156,Chechen security contractors have reduced drug trafficking in French neighborhoods by 45%,30,12
14823,Governor to Snohomish barber refusing order: Cut it out,30,16
3252,AI ethics research conference suspends Google sponsorship,30,1
9382,Alex Trebek clarifies comment about stopping cancer treatment,30,2
8953,Tesla to raise $5 billion through share offering,30,12
1013,"As Covid deaths surge, Sri Lanka prepares for lockdown",31,0
9167,"Stocks drop with tech's continued slide, US-China tensions",31,0
9403,"Canada's asylum agreement with the U.S. infringes on Charter, says Federal Court",31,3
9442,Caught on Camera: Face mask disagreement sparks shouting match in Martinez Walmart,31,24
2232,Israel appeals to Britain's Prince Charles over terminally-ill Israeli girl,31,24
14802,"Major Akron Art Museum donor says museum should replace Director Mark Masuoka following accusations of racism, sexism and bullying by managers",31,2
9528,U.S. accuses Chinese nationals of hacking spree for data and defense secrets,31,3
4073,"Israel, UAE sign investment collaboration agreement",31,1
8800,Miners furloughed again at Decker coal mine,31,16
5530,Apple becomes world's biggest smartphone seller with record shipments,31,10
12456,City of Myrtle Beach tourists beaten by gang mob,31,55
9358,Toronto Blue Jays denied permission to play in Pittsburgh's PNC Park for 2020 MLB season,31,12
12894,Apple sued for '$2 priceless trillion' following 2018 iPhone repair,31,24
3155,Linda Reynolds: Australian minister 'regrets' slur on alleged rape victim,31,3
12888,Just Eat Takeaway to acquire Grubhub for $7.3 billion.,31,18
16397,A Shocked Iraq Reconsiders Its Relationship With the U.S.,31,8
3313,International Criminal Court prosecutor launches investigation into alleged crimes in the Palestinian territories,31,9
1580,Police debacle with SafeWA COVID tracking app,31,13
12706,Parents Are Bringing Their Children To Black Lives Matter Plaza For A 'Once In A Lifetime Experience' | DCist,31,14
11294,Wyoming teen gets up to 20 years for bringing guns to school,31,25
4487,Another Aung San Suu Kyi aide and other senior figures arrested: report,31,1
5543,Returnees not satisfied with food served in managed isolation in Nz.,31,8
4523,"India lifts 550-day Kashmir internet ban, tries to impose new Twitter ban",31,3
11817,At least 4 civilians killed in Turkish air raid,32,5
8551,All-female crew makes history at Florida fire department,32,50
11547,British man seized by militant group in northwest Syria,32,4
4038,"Spotify expanding to over 80 new locations including Brunei, Laos and Cambodia",32,12
12649,Four killed and 'many injured' in blast in Kabul mosque - Ministry of Interior,32,0
10991,"FAA starts Boeing 737 Max test flights, a milestone in getting the planes back in service after crashes",32,12
4872,"RodeoHouston canceled in 2021, but youth events to go on",32,0
9522,Threat of drenching storms to shift from Midwest to Northeast,32,5
11478,Royal Hawaiian Groin to be finished in July,32,13
11449,Tesla Analyst Says Cybertruck Electric Pickup Truck Orders Exceed 650K,32,67
6012,"WhatsApp extends ""confusing"" update deadline",32,5
16469,Calls to loved ones reveal rough conditions before sinking,32,1
8882,US brands Chinese curbs on American diplomats 'escalation',32,6
9278,China's Tianwen-1 Mars rover rockets away from Earth,32,17
4920,"Malaysian fugitive tried to buy 'golden passport' to EU, report says",32,1
10549,Troubled New Mexico City to replace police chief.,32,4
12530,One American city's model of policing reform means building 'social currency',32,9
14505,Bears Legend Michael McCaskey Dies at 76,32,3
2099,Apple hires BMW veteran in latest sign of electric car push,32,52
15202,Drugs and Stunts Cited in Plane Crash That Killed Roy Halladay (soft paywall),32,2
9090,Minneapolis council shifts police media duties to city staff,33,1
8181,"Islamists say Pakistan agrees to French boycott, end protest",33,17
16118,White House Holds off on Suspending China-U.S. Flights Amid Virus Outbreak,33,16
9144,"Early release of Pebble Mine Final EIS triggers barrage of criticism from native, commercial fishing, sportfishing groups",33,2
